text,translated
idk if that means i am depressed or anything like that,그게 내가 우울하거나 그런 것을 의미하는지 궁금하다
in most cases people with depression do not always feel depressed,대부분의 경우 우울증이 있는 사람들이 항상 우울한 것은 아니다
i am too terrified to tell the person above me my boss mostly that i feel depressed due to the unavoidable get over it or such,나는 너무 무서워서 상사에게 내가 어쩔 수 없이 극복하거나 그런 것들 때문에 우울하다고 말할 수 없다
its just so damn hard to not feel depressed with the other things happening in my life,내 인생에서 일어나는 다른 일들에 우울함을 느끼지 않는 것은 너무 어렵다
lately i've just let myself feel depressed empty sad whatever,최근에 나는 그저 우울하고 공허하게 슬퍼했다
instead of saying i am lonely identify sources of stress and try to get more zen with it all,내가 외롭다고 말하는 대신 스트레스의 근원을 확인하고 그것과 함께 더 많은 선을 얻으려고 노력한다
i just don't know whether i am depressed or not,그냥 내가 우울한지 아닌지 모르겠어
i had no reason to feel sad or self harming but i did,나는 슬프거나 자해할 이유가 없었지만 나는 그랬다
most likely she'll feel sad maybe panic to hear that her situation is that bad that a doctor is probably required,아마도 그녀는 그녀의 상황이 의사가 필요할 정도로 나쁘다는 것을 듣고 슬퍼할 것이다
i feel like i don't really deserve to feel this way as in i have no reason to feel sad,나는 내가 슬퍼할 이유가 없기 때문에 내가 이런 식으로 느낄 자격이 없다고 느낀다
for days at a time you feel sad but thats only because you're distracted,며칠 동안 당신은 슬프지만 그것은 단지 당신이 산만하기 때문이다
deep down i am depressed over a break up,나는 마음속으로 헤어짐으로 우울하다
she says that everything makes her feel depressed and she doesn't know why,그녀는 모든 것이 그녀를 우울하게 만들고 왜 그런지 모른다고 말한다
i feel depressed a lot and i try t masking it's humor in front of my friends and it sometimes works,나는 우울함을 많이 느끼고 친구들 앞에서 유머를 감추려고 노력하고 가끔은 효과가 있다
just go and be like hey i am depressed,그냥 가서 내가 우울한 것처럼 굴어
it's absolutely okay to feel depressed and pissed off and anything else you want to feel about this,기분이 우울하고 화가 나도 괜찮아 그리고 네가 이것에 대해 느끼고 싶은 다른 어떤 것도
i am depressed for a long time now and there always were up and downs,나는 지금 오랫동안 우울하고 항상 기복이 있었다
then i remember i am depressed,그때 나는 내가 우울했던 것을 기억한다
when i am alone for long periods of time i do feel depressed and when something bad happens i feel depressed and get racing thoughts,나는 오랫동안 혼자 있을 때 우울하고 나쁜 일이 있을 때 우울하고 흥분되는 생각을 한다
i am lonely and i can't make any friend,나는 외롭고 아무 친구도 사귈 수 없다
i am depressed and anxious i try to do every thing i can and it's never good enough,나는 우울하고 불안하다. 나는 내가 할 수 있는 모든 것을 하려고 노력하지만 그것은 결코 충분하지 않다
i am depressed for a lot of reasons,나는 많은 이유로 우울하다
i can't for sure say i am depressed but i sure feel like it,나는 내가 우울하다고 확실히 말할 수 없지만 나는 확실히 그것을 느끼고 있다
doc i feel sad,doc 나는 슬프다
i don't want to tell anybody i am depressed because i know i don't have a reason to be but i think they might really help me,나는 내가 우울하다는 것을 아무에게도 말하고 싶지 않다. 왜냐하면 나는 내가 그럴 이유가 없다는 것을 알기 때문이다. 하지만 나는 그들이 나에게 정말 도움이 될 것이라고 생각한다
it makes me feel like a freak for having days when i feel sad,그것은 내가 슬픈 날들을 보내는 것에 대해 나를 괴물처럼 느끼게 한다
if you asked me i wouldn't say that i am depressed,네가 나에게 묻는다면 나는 우울하다고 말하지 않을 것이다
he was tired of not knowing why i am sad all the time,그는 내가 왜 항상 슬픈지 모르는 것에 지쳤다
my mum knows that i am depressed but i don't know if she knows how serious it is,우리 엄마는 내가 우울하다는 것을 알지만 나는 그녀가 그것이 얼마나 심각한지 알고 있는지 모르겠다
tldr i am depressed because i am plain like celery,나는 셀러리처럼 평범해서 우울해
i hate how it doesn't matter who you talk to you'll still feel lonely because you feel disconnected from everyone even yourself,나는 네가 누구와 이야기하든 상관없다는 것이 싫다. 왜냐하면 너는 너 자신조차도 모든 사람들과 단절되어 있다고 느끼기 때문이다
it brings me some comfort to know that at least someone out there knows why i am depressed,적어도 누군가 내가 우울한 이유를 알고 있다는 것을 아는 것은 나에게 약간의 위안을 준다
from personal experienceweed just enhanced my current state of mindif i felt sadweed made me feel sadder,"개인적인 경험으로부터, 만약 내가 새드위드가 나를 더 슬프게 만든다고 느낀다면, 위드는 단지 나의 현재 정신 상태를 향상시켰다"
food is the only thing that makes me feel good and i am depressed when i am not eating,음식은 나를 기분 좋게 하고 내가 먹지 않을 때 우울하게 만드는 유일한 것이다
whoa whoa whoa that is a totally valid reason to feel sad,워워워워 그게 슬퍼해야 할 완전히 타당한 이유야
here's what i am struggling with i am depressed but not always,내가 힘들어하는 것은 이것이다. 나는 우울하지만 항상 그렇지는 않다
we help each other out and it's so nice to have someone who is ok when i just tell them i feel sad and will just let me be,우리는 서로를 돕고 내가 그들에게 내가 슬프고 나를 그냥 내버려둘 것이라고 말할 때 괜찮은 사람이 있다는 것이 너무 좋다
it's so easy to feel sad and it's so goddamn hard to be happy,슬픔을 느끼는 것은 너무 쉽고 행복해지는 것은 정말 어렵다
that is the best thing you can do and you're entirely entitled as a human being to feel unhappy whilst doing so,그것이 당신이 할 수 있는 최선의 일이고 당신은 그렇게 하는 동안 불행함을 느낄 전적으로 인간으로서 자격이 있다
yes because nonorganic food is the reason i am depressed not genetics being bullied as a child and having a high stress life,"네, 왜냐하면 유기농 식품이 제가 우울한 이유이기 때문입니다. 어린 시절 유전학적으로 괴롭힘을 당하지 않고 스트레스가 많은 삶을 살고 있습니다"
i don't know if i am depressed or not but i am not here to debate it,나는 내가 우울한지 아닌지 모르지만 나는 그것에 대해 토론하기 위해 여기에 있는 것이 아니다
side note maybe the reason you feel lonely is because you think the people you are talking to don't care for you just a thought,참고로 당신이 외로움을 느끼는 이유는 아마도 당신이 대화하고 있는 사람들이 당신을 신경 쓰지 않는다고 생각하기 때문일 것이다
i am lonely isolated and depressed,나는 외롭고 외롭고 우울하다
i am sad because i am seeing that even when i tried my hardest i am still going to come up a looser,나는 내가 최선을 다했지만 여전히 느슨해질 것이라는 것을 보고 있기 때문에 슬프다
i eat extra sugary carby things when i am depressed,나는 우울할 때 설탕이 많이 든 탄수화물을 많이 먹는다
i feel sad alot these days,나는 요즘 많이 슬퍼
maybe even question if i really do feel sad or depressed or whatever the fuck is going on with me,"어쩌면 내가 정말 슬프거나 우울한지, 아니면 내게 무슨 일이 일어나고 있는지조차 의문일지도 모른다"
tldr   has been an awful year and i am not sure if i am depressed and should seek therapy,tldr은 끔찍한 한 해였고 나는 내가 우울한지 아닌지 확신할 수 없고 치료를 받아야 한다
there are days where nothing is going wrong but i feel depressed,아무 일도 잘못되지 않는 날들이 있지만 나는 우울하다
no one ever thinks i am depressed,아무도 내가 우울하다고 생각하지 않는다
i am depressed because i don't do anything or i don't do anything because i am depressed ,나는 아무것도 하지 않아서 우울하거나 우울해서 아무것도 하지 않는다
i wouldn't tell people i am depressed but i don't feel that great either,나는 사람들에게 내가 우울하다고 말하지 않을 것이지만 나도 그렇게 기분이 좋지 않다
i am mostly sure i am depressed,나는 내가 우울하다고 대부분 확신한다
it's frustrating when people ask mehow are you and all i have to say is that i feel sad and tired,사람들이 나에게 어떻게 지내냐고 물으면 답답하고 내가 할 말은 슬프고 피곤하다는 것뿐이다
here i am  years later about to turn  and i am depressed again,여기서 나는 몇 년 후에 돌아설 것이고 나는 다시 우울하다
and he knows when i am sad and comes up to me and tries to snuggle,그리고 그는 내가 슬플 때를 알고 나에게 다가와 껴안으려고 노력한다
i am depressed overly stressed and i find myself incapable of doing my work to ensure my family's future,나는 우울증에 너무 스트레스를 받고 있고 내 가족의 미래를 보장하기 위해 내 일을 할 수 없다는 것을 발견했다
fuck i am depressed,"젠장, 나 우울해"
the underlying issues with the depression is that i am lonely have negative thoughts and don't know what to do in life for work,우울증의 근본적인 문제는 내가 외롭고 부정적인 생각을 가지고 있고 일을 위해 인생에서 무엇을 해야 할지 모른다는 것이다
i think my job makes me feel unhappy but i can't quit because i need money for living,나는 내 직업이 나를 불행하게 만든다고 생각하지만 나는 살기 위해 돈이 필요하기 때문에 그만둘 수 없다
i don't think she knows i am depressed or how i am feeling,그녀는 내가 우울하거나 기분이 어떤지 모르는 것 같아
i feel sad pissed off sad pissed off,나는 화가 나서 슬프고 화가 났다
what was i thinking feeling everything i felt during that conversation as if i you're right here with me man i feel sad,내가 무슨 생각을 하고 있었는지 그 대화 중에 내가 느낀 모든 것을 느끼는 것은 마치 내가 바로 여기 나와 함께 있는 것처럼 나는 슬프다
i can actually say no i am depressed,나는 사실 아니라고 말할 수 있다. 나는 우울하다
i feel depressed and shitty,나는 우울하고 형편없다
suicide is like the best friend of my depression when i feel depressed suicidal thoughts kicks in most if not all the time,자살은 내가 우울한 자살 생각을 할 때 내 우울증의 가장 좋은 친구와 같다
i don't know what else i should do because i don't care about anything i see no meaning in anything and i just feel depressed all day,나는 아무것도 신경 쓰지 않고 그저 하루 종일 우울하기 때문에 내가 무엇을 더 해야 할지 모르겠다
i can't sleep  my body always hurting  i know i am depressed but what is the point of not being depressed,나는 잠을 잘 수가 없어 내 몸이 항상 아파 내가 우울하다는 것을 알지만 우울하지 않으면 무슨 소용이 있어
i wouldn't say i feel depressed but i just feel boring and nothing brings me joy anymore not even sex,우울하다고는 말하지 않겠지만 그냥 지루하고 섹스조차도 더 이상 나에게 기쁨을 주는 것은 없다
they'll never know that i am depressed,그들은 내가 우울하다는 것을 결코 알지 못할 것이다
i am sad most days,나는 대부분의 날들이 슬프다
what better way to treat depression than by giving the patient another reason to feel depressed i am done whining i am sorry,우울증을 치료하는 더 나은 방법이 환자에게 우울함을 느낄 수 있는 또 다른 이유를 주는 것보다 나는 징징거리는 것을 끝냈다. 미안하다
it makes me even more sad knowing that people can recognize that i am unhappy,사람들이 내가 불행하다는 것을 인식할 수 있다는 것을 아는 것은 나를 더욱 슬프게 한다
you could reframe this though to be more truthful  i am depressed right now,당신은 이것을 더 진실하게 재구성할 수 있지만 나는 지금 우울하다
video games are definitely an escape for me when i am depressed,내가 우울할 때 비디오 게임은 확실히 탈출구이다
i just feel like something's missing and i feel sad and lonely or even mildly depressed,나는 단지 무언가가 빠진 것 같고 슬프고 외롭거나 심지어 약간 우울하다
let him feel sad it's all he's fucking earnt from you,그가 너한테서 얻은 게 다야
and so on or if dhow depressed we feel and t being how long we feel depressed,"우리가 얼마나 우울한지, 그리고 얼마나 오랫동안 우울한지 등등"
maybe it's all the pictures of beautiful women on reddit making me feel depressed about not having a girl friend,아마도 그것은 레딧에 있는 아름다운 여성들의 사진들이 나를 여자친구가 없는 것에 대해 우울하게 만들 것이다
just recently admitted to myself that i am depressed,최근에 내가 우울하다는 것을 스스로 인정했다
chat me up whenever you feel lonely an ill reply,네가 외롭다고 느낄 때마다 나에게 채팅해. 나쁜 답장
maybe i am subconsciously doing this for attention i don't know if i am depressed,아마도 나는 주의를 끌기 위해 무의식적으로 이것을 하고 있을 것이다. 나는 내가 우울한지 모르겠다
i am depressed hard to find stuff that is fun lol,나는 우울해서 재미있는 것을 찾기가 힘들어 ㅋㅋㅋ
to about ish and my mothers just been getting mad at me i tell her its depression she just says i need to wake up earlier and i won't feel depressed,나는 그녀에게 우울증이 있다고 말했고 그녀는 내가 더 일찍 일어나야 한다고 말했고 나는 우울함을 느끼지 않을 것이라고 말했다
doing random stuff makes me feel better and i am lonely,무작위로 하는 것은 나의 기분을 나아지게 하고 나는 외롭다
i am lonely every single day,나는 매일매일 외롭다
i am depressed partly because of the terrible financial situation i find myself in,나는 부분적으로 내가 처한 끔찍한 재정 상황 때문에 우울하다
i started to feel depressed around christmas time due to relationships not working out me constantly being paranoid and my just general health getting worse,"나는 크리스마스 즈음에 우울해지기 시작했는데, 그 이유는 관계가 지속적으로 편집증에 걸렸고, 나의 일반적인 건강은 악화되었기 때문이다"
it's funny nobody even knows that i am lonely,아무도 내가 외롭다는 것을 모른다는 것이 웃기다
i wish you the best of luck and know that you may feel lonely but you are not alone,나는 너에게 행운이 있기를 바라고 네가 외로울지도 모르지만 너는 혼자가 아니라는 것을 알아
i am lonely and i can't find any meaning or reason in my life,나는 외롭고 내 삶에서 어떤 의미나 이유도 찾을 수 없다
i want to get a therapist but i don't want to burden my parents by letting them even know that i am depressed,나는 치료사를 구하고 싶지만 내가 우울하다는 것을 부모님에게 알려서 그들에게 부담을 주고 싶지 않다
was and still am depressed,예전에도 그리고 여전히 우울하다
the reason i am depressed is because i don't have a job and sometimes i'll go on my job finding apps at night and email them to myself,내가 우울한 이유는 내가 직업이 없기 때문이고 때때로 나는 밤에 앱을 찾아서 내 일을 하고 스스로에게 이메일을 보낼 것이다
it was the only part of the day i didnt feel lonely,그것은 내가 외롭지 않은 하루의 유일한 부분이었다
hey man i am depressed and sometimes it gets really bad when i have a dispute with my girlfriend too,이봐 친구 나는 우울해 그리고 가끔 내 여자친구와 분쟁이 있을 때 정말 나빠져
so i am not quite sure whats going on with me i am not even sure if i am depressed,그래서 나는 나에게 무슨 일이 일어나고 있는지 잘 모르겠다. 나는 심지어 내가 우울한지도 잘 모르겠다
hi everybody i was put on zoloft to months ago and i still feel sad and depressed i have cerebral plasy so i can't get out much what should i do,"안녕하세요, 여러분 저는 몇 달 전부터 졸로프트를 탔고, 저는 여전히 슬프고 우울합니다. 저는 뇌염이 있어서 밖으로 많이 나올 수가 없어요. 어떻게 해야 할까요"
i have quite a few friends but i feel lonely all of the time even when with them,나는 친구들이 꽤 많지만 그들과 함께 있어도 항상 외로움을 느낀다
i realize i am depressed but i just don't care anymore,나는 내가 우울하다는 것을 알지만 더 이상 신경 쓰지 않는다
i am depressed about things i can't change,나는 내가 바꿀 수 없는 것들에 대해 우울하다
i am not clingy i am lonely,나는 집착하지 않아 나는 외로워
even until now i still feel depressed maybe not as bad as before,지금까지도 나는 여전히 우울함을 느낀다. 아마도 전만큼 나쁘지는 않을 것이다
i tend to buy less useless shit when i am depressed,나는 우울할 때 쓸모없는 똥을 덜 사는 경향이 있다
no matter how hard i try i cant make myself accept that i am depressed,내가 아무리 노력해도 내가 우울하다는 것을 받아들일 수 없다
my depression is the kind where i know why i am depressed,나의 우울증은 내가 왜 우울한지 아는 종류이다
i can't tell if i am depressed though,하지만 나는 내가 우울한지 아닌지 말할 수 없다
i am at my wits end i am depressed and crying daily,나는 어찌할 바를 모르고 매일 우울하고 운다
usually i feel like that because i am depressed,보통 나는 우울하기 때문에 그렇게 느낀다
hi yes it is normal not to feel sad,"안녕, 응 슬퍼하지 않는 것은 정상이야"
i always feel lonely even when i am surrounded by people so i just surround myself with more people and somehow that doesn't make me any less lonely,나는 항상 사람들에게 둘러싸여도 외로움을 느끼기 때문에 더 많은 사람들로 나를 둘러쌀 뿐이고 그것이 나를 덜 외롭게 만들지는 않는다
which at the time i am depressed i coin as misanthropy as well,"그 당시에 나는 우울해 있었고, 나는 남성혐오증을 앓고 있었다"
whenever i feel lonely i go here only to realise i am not,내가 외로울 때마다 나는 내가 아니라는 것을 깨달았을 뿐이다
i know the difference between people not caring and thinking people don't care because i am depressed,나는 사람들이 신경 쓰지 않는 것과 내가 우울하기 때문에 사람들이 신경 쓰지 않는다고 생각하는 것의 차이를 안다
i am sad and hurt and not sure if he's sending a clear message,나는 슬프고 상처받았고 그가 명확한 메시지를 보내고 있는지 확신할 수 없다
then i feel depressed a bit or maybe just sad especially at what i used to have four years ago,그리고 나서 나는 약간 우울하거나 아마도 내가 4년 전에 가졌던 것에 대해 특히 슬플 것이다
i figure this is relevant to this sub because i am depressed and fucked up because of it,나는 이것이 이 잠수함과 관련이 있다고 생각한다. 왜냐하면 나는 그것 때문에 우울하고 엉망이기 때문이다
when i first went to my doctor whom i had never met before i simply stated i think i am depressed and we went from there p,내가 처음으로 내가 전에 만난 적이 없는 내 의사에게 갔을 때 나는 내가 우울하다고 간단히 말했고 우리는 거기서부터 갔다
yea as if the good memories feel lonely in a desert of depression,응 좋은 기억들이 우울의 사막에서 외로움을 느끼는 것처럼
i can't tell if i am depressed because i am broke or i am broke because of my depression,나는 내가 돈이 없어서 우울한지 아니면 내가 우울증 때문에 돈이 없어서 우울한지 구별할 수 없다
workout when you feel sad or listen to music,당신이 슬프거나 음악을 들을 때 운동을 합니다
i just feel like anyone who gets to know me is going to hate me and dump me if i tell them when i am sad,나는 내가 슬플 때 그들에게 말하면 나를 미워하고 나를 차버릴 것 같은 느낌이 들 뿐이다
because i was able to do this and i myself am depressed i looked out seeing if others where depressed and id talk to them for hours,왜냐하면 나는 이것을 할 수 있었고 나 자신도 우울하기 때문이다. 나는 우울한 다른 사람들이 있는지 살펴보고 몇 시간 동안 그들과 이야기했다
it's not the reason i am depressed you know what i mean,그게 내가 우울한 이유가 아니야 내가 무슨 말을 하는지 알잖아
i don't really want to go home again because i don't want to feel that amotivated' again just to feel depressed and crappy like always,나는 다시는 집에 가고 싶지 않다. 왜냐하면 나는 단지 항상처럼 우울하고 쓰레기 같은 기분을 느끼고 싶지 않기 때문이다
i keep trying to avoid the things that make me feel depressed but its impossible,나는 나를 우울하게 만드는 것들을 피하려고 계속 노력하지만 그것은 불가능하다
i feel like i am not a rude douchebag when i am depressed,나는 내가 우울할 때 무례한 멍청이가 아니라고 느낀다
i am sad alienated and i dont know what to do,나는 슬픈 소외감을 느끼고 어떻게 해야 할지 모르겠다
i don't suppose you just call the hospital and say i am sad,나는 네가 그냥 병원에 전화해서 내가 슬프다고 말하지 않는다고 생각한다
apart from that i don't have any trouble explaining why i am depressed but this might be a bit too personal to me,그것을 제외하고 나는 내가 왜 우울한지 설명하는 데 어려움이 없지만 이것은 나에게 너무 개인적일 수 있다
this is making me feel inadequate and making me feel depressed as a result,이것은 나를 불충분하게 느끼게 하고 결과적으로 나를 우울하게 만든다
i feel depressed and i don't want to live another moment to think about this issue,나는 우울하고 이 문제에 대해 생각하는 순간을 더 살고 싶지 않다
like i find myself sitting on facebook or something because i am lonely or just staring at my computer screen or getting off my computer and lying on the bed,외롭거나 컴퓨터 화면을 쳐다보거나 컴퓨터에서 내려 침대에 누워있는 내 자신을 발견하는 것처럼
i suspect that i am depressed but i have not been diagnosed with depression,나는 내가 우울하다고 의심하지만 우울증 진단을 받지는 않았다
i dont feel depressed but i dont think this is something i should just shrug off,나는 우울함을 느끼지 않지만 이것은 내가 그냥 무시해야 할 것이라고 생각하지 않는다
i rarely feel depressed anymore,나는 더 이상 우울함을 거의 느끼지 않는다
i just feel sad and stuck,나는 그저 슬프고 막혔다
they know i am depressed just not how depressed i actually am,그들은 내가 실제로 얼마나 우울한지가 아니라 내가 우울하다는 것을 안다
my grades are really horrible because i am depressed i am depressed because my grades are horrible  whatever,내 성적은 정말 끔찍해 왜냐하면 나는 우울해. 내 성적이 뭐든 끔찍해
i think anyone would feel sad being left out,나는 누구나 소외된 것이 슬프다고 생각한다
i'll tell you right now i am  i am depressed i have aspergers a form of autism and i've been really suicidal lately,내가 지금 너에게 말해줄게 나는 우울해. 나는 자폐증의 일종인 아스퍼거가 있어. 그리고 나는 최근에 정말 자살하고 있어
i feel depressed all the time but it's mild and manageable for the most part,나는 항상 우울하지만 대부분 온화하고 다루기 쉽다
this in turn makes me feel ashamed that i do feel depressed compounding everything from the get go,이것은 차례로 내가 처음부터 모든 것을 복잡하게 만드는 우울함을 느끼는 것을 부끄럽게 만든다
i have all of these thoughts and ideas about myself and when i am depressed it all makes sense,나는 나 자신에 대한 모든 생각과 생각을 가지고 있고 내가 우울할 때 그것은 모두 이치에 맞는다
she's told me before it's my fault i am lonely,그녀는 내 잘못이기 전에 내게 외롭다고 말했다
at this point i don't know what to do i am actually angry that i am depressed,이 시점에서 나는 무엇을 해야 할지 모르겠다. 나는 사실 내가 우울하다는 것에 화가 난다
