text,translated
remember that it's a disease and it's fine for you to not know why you feel depressed,그것은 질병이고 당신이 왜 우울한지 모르는 것은 괜찮다
i can tell you i am depressed,나는 너에게 내가 우울하다고 말할 수 있다
when i see people i instantly feel sad,나는 사람들을 보면 즉시 슬퍼진다
i am depressed simply because i never had a girlfriend,나는 단지 여자친구가 없었기 때문에 우울하다
my boyfriend knows i am depressed i don't think he really knows how bad it's gotten or that he really understands,내 남자친구는 내가 우울하다는 것을 알고 있다. 나는 그가 그것이 얼마나 나빠졌는지 또는 그가 정말로 이해하는지 알지 못한다고 생각한다
in a room full of people kissing my ass i still feel lonely like i am trapped on some strange fucking planet,내 엉덩이에 키스하는 사람들로 가득 찬 방에서 나는 여전히 내가 어떤 이상한 행성에 갇힌 것처럼 외로움을 느낀다
the problem is that i feel lonely,문제는 내가 외로움을 느낀다는 것이다
i am depressed often but didn't go into that,나는 자주 우울하지만 그것에 들어가지 않았다
i told my doctor i am depressed but never about my suicidal thoughts she wants me to go to a therapist before she gives any drugs,나는 내 의사에게 내가 우울하다고 말했지만 그녀는 그녀가 어떤 약을 주기 전에 내가 치료사에게 가기를 원한다
but then again i dont really feel sad its more numbness and a complete lack of motivation,하지만 다시 말하지만 나는 더 많은 마비와 완전한 동기 부여 부족이 정말 슬프지 않다
i am depressed and taking medication which usually helps,나는 우울하고 보통 도움이 되는 약을 먹고 있다
i guess maybe i am lonely but i still get depressed around others,외로울 수도 있지만 다른 사람들 주변에서는 여전히 우울해요
i don't know why i am depressed or what to do about it,나는 내가 왜 우울한지 또는 그것에 대해 무엇을 해야 하는지 모르겠다
when i am sad it's harder for me to fake it for my family and friends because i am crying and empty inside,내가 슬플 때 내 가족과 친구들을 위해 그것을 속이는 것은 내가 울고 속이 비어 있기 때문에 더 어렵다
sometimes i feel like when i am happy my work is at my best when i am depressed,때때로 나는 내가 행복할 때 내가 우울할 때 내 일이 최고라고 느낀다
i am depressed or at least i think i am,나는 우울하거나 적어도 나는 그렇다고 생각한다
china is bullying everyone around it because of territorial waters bang i am sad,중국은 영해 때문에 주변의 모든 사람들을 괴롭히고 있어 쾅 나는 슬프다
i don't cry when i am depressed i never have,나는 우울할 때 울지 않는다. 나는 한번도 울지 않았다
i was reading a little and people relate this to depression but i really don't think i am depressed,나는 조금 읽고 있었고 사람들은 이것을 우울증과 연관짓지만 나는 정말 우울하다고 생각하지 않는다
i am depressed myself and i abuse alcohol,나는 나 자신이 우울하고 술을 남용한다
sometimes i think i made wrong choice dropping out of architecture and wasting a year  anyway i am depressed and anxious,때때로 나는 내가 잘못된 선택을 했다고 생각한다. 건축을 그만두고 1년을 낭비한다. 어쨌든 나는 우울하고 불안하다
i love to shop but when i am lonely i usually just sit around and dwell on it,"나는 쇼핑하는 것을 좋아하지만, 내가 외로울 때 나는 보통 둘러앉아 그것에 대해 곰곰이 생각한다"
it took me years to even get to the point that i would say out loud i am depressed even to an empty room,심지어 빈 방에도 우울하다고 큰소리로 말할 정도까지 도달하는 데 몇 년이 걸렸다
i feel like when i am depressed i pick up on other people's emotions much more although only the negative ones,나는 내가 우울할 때 부정적인 감정만 있어도 다른 사람들의 감정을 훨씬 더 잘 이해하는 것 같다
the list of side effects is so long and fairly horrible sounding and i am still not even  convinced i am depressed,부작용의 목록은 너무 길고 꽤 끔찍하게 들리고 나는 여전히 내가 우울하다는 것을 확신하지 못한다
i have anxiety and depression and when i feel depressed i often feel sick and almost throw up,나는 불안과 우울증이 있고 우울할 때 나는 자주 아프고 거의 토할 것 같다
the problem is i have to hide all of this from my boyfriend because he doesn't like that i am depressed,문제는 내가 우울해하는 것을 좋아하지 않기 때문에 내가 내 남자친구에게 이 모든 것을 숨겨야 한다는 것이다
i cannot find the energy to care about other people when i am depressed even faking it is wearing thin,나는 우울할 때 다른 사람을 신경 쓸 에너지를 찾을 수 없다. 심지어 그것이 얇아진 것처럼 가장해도
it makes you feel lonely and unloved even if you are surrounded by a sea of love,그것은 당신이 사랑의 바다에 둘러싸여 있어도 당신을 외롭고 사랑받지 못하게 만든다
sure the doctor says i am depressed but is this what depression really feels like because honestly it's a horrible feeling,물론 의사는 내가 우울하다고 말하지만 솔직히 우울증은 끔찍한 느낌이기 때문에 이것이 진정한 우울증의 느낌인가요
i don't think i am depressed well maybe,나는 내가 우울하다고 잘 생각하지 않는다
you want to go to school but you just can't motivate to because you feel depressed,당신은 학교에 가고 싶지만 우울하기 때문에 동기부여를 할 수 없다
i am sad that he is depressed too but i haven't felt that connected to anyone in a long time,나는 그가 우울해 하는 것도 슬프지만 오랫동안 누구와도 연결되어 있다고 느끼지 못했다
the only thing i know is that when i am sad i become more sad and it never ends even when there's no reason,내가 아는 유일한 것은 내가 슬플 때 나는 더 슬퍼지고 이유가 없을 때에도 결코 끝나지 않는다는 것이다
i have gathered about  pictures and gifs from funny sites and i watch them whenever i feel depressed,나는 재미있는 사이트의 사진과 GIF에 대해 모았고 우울할 때마다 그것들을 본다
my best friend doesn't know i am depressed nobody does,내 가장 친한 친구는 내가 우울하다는 것을 아무도 모른다
i guess it's my drug of choice whenever i am sad i just drink a few mountain dews and everything's better at least slightly,내가 슬플 때마다 내가 선택한 약인 것 같아. 그냥 마운틴 이슬을 몇 잔 마시면 모든 게 조금은 나아져
so scared that it's the reason i am unhappy,너무 무서워서 그게 내가 불행한 이유야
even a friend who understands i am depressed doesn't really understand when she asks why i feel low or when telling me i just have to try,내가 우울하다는 것을 이해하는 친구조차도 그녀가 내가 왜 기분이 우울한지 물어볼 때나 나에게 그냥 노력해야 한다고 말할 때 정말 이해하지 못한다
 i am sad all the time,나는 항상 슬프다
i am under the suspicion that i am depressed but if i mention anything to mg family they freak out and get mad at me,나는 내가 우울하다는 의심을 받고 있지만 만약 내가 가족에게 어떤 말을 하면 그들은 나에게 겁을 먹고 화를 낸다
p and i've been playing games with my family when i feel depressed,그리고 나는 우울할 때 가족들과 게임을 해왔다
i am depressed and annoyed by existing is that hard to understand,나는 우울하고 기존의 것이 이해하기 어렵다는 것에 짜증이 난다
my bf left me because i am depressed and i m adopted my parents are not loving me,내 남자친구는 내가 우울하고 입양되었기 때문에 나를 떠났고 나의 부모님은 나를 사랑하지 않는다
but no one ever directly addresses it with me as if they are scared of it and who i am when i am depressed,하지만 아무도 그것이 두렵고 내가 우울할 때 내가 누구인지를 두려워하는 것처럼 나와 함께 직접적으로 이야기하지 않는다
but i still feel lonely and angry,하지만 나는 여전히 외롭고 화가 난다
i usually snack instead of having big meals when i am depressed,나는 우울할 때 많은 식사를 하는 대신 간식을 먹는다
it's totally normal to feel sad at times,가끔 슬퍼하는 것은 완전히 정상이다
whether i get any new info from them is unsure because i am well aware of why i am depressed why i am stuck being depressed and how to change it,"내가 그들로부터 새로운 정보를 얻었는지는 확실하지 않다. 왜냐하면 나는 내가 왜 우울한지, 그리고 그것을 어떻게 바꿀지 잘 알고 있기 때문이다"
its just that no therapeutic treatment is going to help me get over my depression and anxiety and why i am depressed,어떤 치료도 내가 우울증과 불안감을 극복하는 데 도움이 되지 않을 것이고 왜 내가 우울한지
that simplistic approach can be detrimental to someone who doesn't know why they feel depressed or lacking in confidence,그 단순한 접근법은 그들이 왜 우울하거나 자신감이 부족한지 모르는 사람에게 해로울 수 있다
depression is unbalanced chemicals in the brain you don't need a reason to feel depressed you just are,우울증은 뇌의 불균형한 화학물질입니다. 우울함을 느낄 이유가 필요하지 않습니다
i am not even sure i am sad,나는 심지어 내가 슬프다는 확신이 없다
sometimes i have trouble being aware that i am depressed,때때로 나는 내가 우울하다는 것을 인식하는 데 어려움을 겪는다
but when i am alone i feel sad,하지만 나는 혼자 있을 때 슬프다
i am depressed and a bit suicidal and i just want someone to talk to,나는 우울하고 약간 자살적이고 단지 누군가와 이야기하기를 원한다
also list the main reasons you feel depressed and try to come with solutions or at least improvements,또한 당신이 우울함을 느끼는 주요 이유를 열거하고 해결책이나 최소한의 개선책을 가져오려고 노력한다
i almost don't want to admit i am depressed,나는 내가 우울하다는 것을 거의 인정하고 싶지 않다
if i tell her she's going to think it's her fault i am depressed,만약 내가 그녀에게 그녀가 자신의 잘못이라고 생각할 것이라고 말하면 나는 우울하다
i also feel depressed and semisuicidal quite often and for me it helps,나는 또한 꽤 자주 우울함과 반자살을 느끼고 그것은 나에게 도움이 된다
it's when i have to go out into society that i start to feel depressed anxious angry and overwhelmed,내가 사회에 나가야 할 때 나는 불안하고 분노하며 압도당하며 우울해지기 시작한다
yes i am depressed and this would be nice lol,응 나는 우울해 그리고 이것은 좋을 거야 ㅋㅋㅋ
i wish this were a new phenomena but its not i am sad to say,나는 이것이 새로운 현상이기를 바라지만 슬프지는 않다
how can i escape this loop i am depressed because i am failing i am failing because i am depressed,어떻게 하면 이 루프에서 벗어날 수 있을까? 나는 실패하고 있기 때문에 우울하다. 나는 우울하기 때문에 실패하고 있다
i am lonely sitting in my apartment don't know how to deal with outside world,나는 내 아파트에 앉아 있는 것이 외롭다. 바깥 세상을 다루는 법을 모른다
regardless of that though i still feel sad the majority of the time,그럼에도 불구하고 나는 여전히 대부분의 시간을 슬프게 느낀다
it doesn't sound like much but whenever i feel lonely i go out for a walk and visit random stores cafes or restaurants,그렇게 많이 들리지는 않지만 외로울 때마다 나는 산책을 나가서 카페나 식당을 무작위로 방문한다
i used to feel depressed all the time but now i seem to have episodes,나는 항상 우울했지만 지금은 에피소드가 있는 것 같다
has anyone else ever felt this maybe i feel depressed because i am not taking charge of my life and am mostly relying on my parents,내가 내 삶을 책임지지 않고 대부분 부모님에게 의존하고 있기 때문에 우울할 수도 있다는 것을 느낀 다른 사람이 있나요
not really but it's one of the few things that makes me feel a little better when i am sad,그렇지는 않지만 슬플 때 기분이 조금 나아지는 몇 안 되는 것들 중 하나이다
i honestly can't tell if i am depressed or am simply in a funk,나는 솔직히 내가 우울한지 아니면 단순히 공황 상태인지 알 수 없다
hygiene is always the first thing to go for me when i am depressed like i am currently,내가 지금처럼 우울할 때는 항상 위생이 가장 먼저이다
but it's also the hardest thing to do when i am depressed,하지만 내가 우울할 때 가장 하기 힘든 일이기도 하다
but then when i feel lonely it feels like i've brought it upon myself,하지만 내가 외로울 때는 내가 자초한 것처럼 느껴진다
i am depressed that almost everyone i know is going to a college better than i am despite the fact that i tried my hardest,나는 내가 최선을 다했음에도 불구하고 내가 아는 거의 모든 사람들이 나보다 더 나은 대학에 가고 있다는 것에 우울하다
my dad thinks i am depressed but he doesn't think its important for me to get checked out,우리 아빠는 내가 우울하다고 생각하지만 그는 내가 체크아웃 받는 것이 중요하다고 생각하지 않는다
if they aren't happy  i am sad as well all the time,그들이 행복하지 않다면 나도 항상 슬프다
i miss the comfort in being sad  kurt cobain there's certain things i can accomplish when i am depressed and certain things i can when i am not,나는 슬픈 커트 코베인이 되는 것의 위안이 그립다. 내가 우울할 때 할 수 있는 특정한 것과 그렇지 않을 때 할 수 있는 특정한 것들이 있다
all my friends already know that i am depressed and that i've been suicidal and stuff and recently things are being a liiiittle bit better,내 모든 친구들은 내가 우울하고 자살하고 있다는 것을 이미 알고 있고 최근 상황이 조금 나아지고 있다
and it made me angry because i was paying someone to tell me useless crap like next time you feel depressed get up and take a walk,그리고 그것은 내가 누군가에게 돈을 주고 다음에 우울할 때 일어나서 산책하는 것처럼 쓸데없는 헛소리를 하고 있었기 때문에 나를 화나게 했다
when i was pregnant my doctor said that it's much worst to feel depressed or in my case extreme anxiety,내가 임신했을 때 내 의사는 우울하거나 내 경우 극도의 불안을 느끼는 것이 훨씬 최악이라고 말했다
why damage your body and feel pain why not just do something definitive and end your life i am depressed have been for  years,왜 당신의 몸을 손상시키고 고통을 느끼나요? 결정적인 무언가를 하고 당신의 우울한 삶을 끝내지 않는 이유는 무엇인가요
i feel sad a lot and unmotivated,나는 많이 슬프고 의욕이 없다
every day before i go to sleep i feel sad,매일 잠들기 전에 나는 슬프다
i just feel like i don't deserve to say that i am depressed because i haven't had anything happen to me that is all that bad,나는 단지 내가 우울하다고 말할 자격이 없다고 느낀다. 왜냐하면 나는 나에게 그렇게 나쁜 일이 일어나지 않았기 때문이다
i know i am depressed but i can't really feel it all the way and i can never feel happy,나는 내가 우울하다는 것을 알지만 나는 그것을 완전히 느낄 수 없고 결코 행복할 수 없다
god i am depressed,"맙소사, 나는 우울해"
he doesn't understand that there is no pin pointed reason that i feel depressed,그는 내가 우울함을 느끼는 뚜렷한 이유가 없다는 것을 이해하지 못한다
i don't like to admit to anyone especially myself that i feel depressed but i don't think there's anyway convincing myself otherwise,"나는 특히 나 자신에게 내가 우울하다는 것을 누구에게도 인정하고 싶지 않지만, 그렇지 않으면 어쨌든 나를 설득할 수 있다고 생각하지 않는다"
but the damage is done and i am lonely as hell,하지만 피해는 끝났고 나는 지옥처럼 외롭다
you don't have to have a reason to feel depressed,우울할 이유가 있을 필요는 없다
the only person who knows what you're feeling is you and if you feel depressed i recommend seeing a doctor,당신이 무엇을 느끼는지 아는 유일한 사람은 당신이고 만약 당신이 우울하다면 나는 의사에게 진찰을 받는 것을 추천한다
i have been struggling with depression and the worst part is i feel like i can't talk to anyone when i am sad,나는 우울증과 싸우고 있고 가장 나쁜 부분은 내가 슬플 때 아무와도 이야기할 수 없다는 것이다
i am sad for no reason and now i am crying,나는 아무 이유 없이 슬퍼서 지금 울고 있어
i have a bad personality i am ugly i am the worst person in the world  that's why i am lonely according to my own father,나는 나쁜 성격을 가지고 있다. 나는 못생겼다. 나는 세상에서 가장 나쁜 사람이다. 그것이 내 아버지에 따르면 내가 외로운 이유이다
how am i gonna function in society if i cant admit i am depressed after all these years being mentally ill shaped me into something i hate,만약 내가 수년간 정신병을 앓은 후에 우울하다는 것을 인정할 수 없다면 내가 사회에서 어떻게 기능할 것인가
now i am depressed,지금 나는 우울하다
hell even my parents don't know i am depressed,내 부모님조차도 내가 우울하다는 것을 모른다
nothing is really bad in my life but i do feel lonely and i really don't feel like burden anyone with it even with my closest friends,내 인생에서 정말 나쁜 것은 없지만 나는 외로움을 느끼고 심지어 가장 가까운 친구들과 함께조차도 그것으로 누군가에게 부담을 주고 싶지 않다
it feels much more normal than being happy because i feel sad so much more often,나는 더 자주 슬픔을 느끼기 때문에 행복한 것보다 훨씬 더 정상적으로 느껴진다
sometimes it feels like im forcing myself to feel sad and i dont even know why because i dont want to be sad,가끔은 내가 슬퍼하도록 강요하는 것처럼 느껴지고 슬퍼하고 싶지 않기 때문에 왜 그런지조차 모르겠어
when i am depressed my anxiety levels also sky rockets,내가 우울할 때 나의 불안 수준 또한 스카이 로켓이다
whenever i think like this it makes me feel sad and lonely because i feel helpless to my situation,내가 이렇게 생각할 때마다 내 상황에 무력감을 느끼기 때문에 그것은 나를 슬프고 외롭게 만든다
although there was a bit that made me feel unhappy there i also had some sense of security and independence,비록 그곳에서 나를 불행하게 만드는 약간의 것이 있었지만 나는 또한 약간의 안정감과 독립심을 가지고 있었다
people say they feel depressed after watching a sad movie,사람들은 슬픈 영화를 보고 우울하다고 말한다
i don't really feel sad but i do feel like life is passing me by,나는 정말 슬프지는 않지만 삶이 나를 스쳐 지나가는 것 같다
you're not going to feel sad for your loved ones after you take the exit because you will no longer exist,당신은 더 이상 존재하지 않을 것이기 때문에 출구를 떠난 후 사랑하는 사람들에게 슬퍼하지 않을 것이다
tldr i am sad dear reddit friends,친애하는 레딧 친구들에게 나는 슬프다
then it feels like i am lonely for no reason after all i am surrounded by friends but there actually is a reason,친구들에게 둘러싸여 있으니 왠지 외롭지만 사실은 이유가 있다
when i am depressed i feel that is all i ever known in my life,내가 우울할 때 나는 그것이 내 인생에서 내가 아는 전부라고 느낀다
not because i am depressed or whatever,내가 우울해서가 아니다
actually i tell myself this even when i am depressed fake it til you make it if you will,사실 나는 내가 우울할 때 조차도 네가 할 수 있을 때까지 가짜라고 스스로에게 말한다
if it wasn't real we wouldn't have a name for it right you don't deserve to feel sad,그것이 진짜가 아니었다면 우리는 그것에 대한 이름을 가지고 있지 않았을 것입니다. 당신은 슬퍼할 자격이 없습니다
i wouldn't say i am lonely i have tonnes of friends just none that i'd ever talk to about how i am actually feeling,나는 내가 외롭다고 말하지 않을 것이다. 나는 내가 실제로 어떻게 느끼는지에 대해 이야기한 적이 없는 친구들이 많다
hello im a  year old boy and i think i am depressed,안녕하세요 저는 1살 소년이고 우울한 것 같아요
i guess i should have clarified that it wasn't because i am depressed,내가 우울해서가 아니라는 것을 분명히 했어야 했다고 생각한다
it's difficult to answer this question but i am  and i've had some pretty shitty stuff happen and i feel depressed more often than not,이 질문에 대답하는 것은 어렵지만 저는 그리고 저는 꽤 형편없는 일들을 겪었고 저는 종종 우울해요
i feel sad for what i can't do,나는 내가 할 수 없는 것에 대해 슬프다
but i don't know about you guys but the moments of happiness end up making me feel sadder than the depression itself,하지만 나는 너희들에 대해 잘 모르지만 행복의 순간들은 결국 나를 우울 그 자체보다 더 슬프게 만든다
therapist told me i am depressed today,치료사는 나에게 오늘 우울하다고 말했다
i used to feel sad and terrified of being alone all the time a few years back but now i haven't felt anything in a while,몇 년 전에는 항상 혼자 있는 것에 대해 슬프고 무서웠지만 지금은 한동안 아무 것도 느끼지 못했다
no one to talk to i never really talk about problems anyway the most being i drunkenly told one of my best friends i am depressed,대화할 사람이 아무도 없다. 어쨌든 나는 문제에 대해 정말로 이야기하지 않는다. 나는 술에 취해 내 가장 친한 친구 중 한 명에게 내가 우울하다고 말했다
hey man i am just browsing here because i feel lonely,"이봐 친구, 나는 외롭기 때문에 그냥 여기를 둘러보고 있어"
this is pretty much my exact situation and why i feel depressed,이것이 거의 나의 정확한 상황이고 내가 우울한 이유이다
but i've seen them sleep with a different girl every night and i know that's college but it makes me feel lonely,하지만 나는 그들이 매일 밤 다른 여자와 자는 것을 보았고 그것이 대학이라는 것을 알지만 그것은 나를 외롭게 만든다
it's not that i am depressed so much but i just can't stop wondering about suicide,내가 그렇게 우울한 것은 아니지만 자살에 대한 궁금증을 멈출 수 없다
i live alone in a big house and i don't have a lot of people that i consider 'friends' so i am lonely very often,나는 큰 집에서 혼자 살고 있고 '친구'라고 생각하는 사람이 많지 않아서 매우 자주 외롭다
i don't know i don't think i am depressed but i know these thoughts aren't normal ,나는 내가 우울하다고 생각하지 않는다는 것을 모르지만 나는 이러한 생각이 정상이 아니라는 것을 안다.
the fact that i am cynical quiet negative and countless other things doesn't go away when i say i am depressed,내가 냉소적이고 부정적이라는 사실과 내가 우울하다고 말할 때 다른 무수한 것들이 사라지지 않는다
i have the same problem and my family just doesn't believe that i am depressed,나도 같은 문제가 있고 우리 가족은 내가 우울하다는 것을 믿지 않는다
i am constantly bothered by people who do not know i am depressed the phone rings too often people i have no desire to see want to hang out,나는 내가 우울한 줄 모르는 사람들 때문에 끊임없이 괴롭다. 내가 보고 싶지 않은 사람들이 너무 자주 전화가 걸려온다
i had to breakdown emotionally to tell them i am depressed and suicidal after all these years because i felt so repressed,나는 그들에게 내가 너무 억압받았기 때문에 수년 후에 우울하고 자살했다고 말하기 위해 감정적으로 무너져야 했다
and i feel lonely very lonely,그리고 나는 매우 외롭다
i feel more alive in a sense when i am depressed,나는 우울할 때 어떤 의미에서 더 살아있음을 느낀다
no i don't think i am depressed on purpose and it definitely isn't easier to be depressed,아니 나는 내가 일부러 우울하다고 생각하지 않고 우울해지는 것이 확실히 더 쉽지 않다
i am certain i am depressed,나는 내가 우울하다고 확신한다
it's like is pointing out that i am sad really gonna help me be less sad,내가 슬프다는 것을 지적하는 것은 내가 덜 슬프도록 도와줄 것이다
