idx,text,translated,cnt,weakest_cnt,strongest_cnt
0,i am sad for both of them and i hope something changes for the better,나는 그들 모두에게 슬프고 나는 무언가가 더 나은 방향으로 바뀌기를 바란다,0,0,0
1,it feels like all i ever achieve through what for me feels like a herculean effort to not feel unhappy is that i break even and barely,불행함을 느끼지 않기 위해 내가 힘든 노력으로 느끼는 것을 통해 내가 성취하는 모든 것은 내가 손익분기점을 깨고 간신히 얻는 것처럼 느껴진다,0,0,0
2,so yet again i lose the person that i tell everything to and makes me feel better when i am depressed,그래서 다시 나는 내가 모든 것을 말할 수 있는 사람을 잃고 우울할 때 기분이 나아지게 한다,0,0,0
3,i need to realize i am unhappy for no reason,나는 내가 이유 없이 불행하다는 것을 깨달아야 한다,0,0,0
4,i don't feel like i've done anything to make anyone proud of me in a long time and nobody but reddit knows i am depressed,나는 내가 오랫동안 누군가에게 나를 자랑스럽게 만들기 위해 아무것도 한 것 같지 않고 레딧 외에는 아무도 내가 우울하다는 것을 안다,0,0,0
5,family is kind of nuts but not extremely horrible got a great girlfriend and of course like you i am depressed,가족은 약간 미쳤지만 아주 나쁘지는 않아. 좋은 여자친구가 생겼고 물론 너처럼 나도 우울해,0,0,0
6,i want to be alone but i am lonely,나는 혼자 있고 싶지만 외롭다,0,0,0
7,it can be hard to consider depression the culprit when you don't specifically feel sad but it's possible it's hiding behind the numbness,당신이 특별히 슬프다고 느끼지 않을 때 우울증을 범인으로 간주하는 것은 어려울 수 있지만 그것이 마비 뒤에 숨어 있을 수 있다,0,0,0
8,remember that if you must dwell dwell on what it is making you feel depressed rather than depression itself,만약 당신이 우울증 그 자체보다는 그것이 당신을 우울하게 만드는 것이 무엇인지에 대해 곰곰이 생각해야 한다면 기억하세요,0,0,0
9,it's ok to feel sad and depressed and it's ok to cry,슬프고 우울한 기분을 느끼는 것은 괜찮고 우는 것도 괜찮다,0,0,0
10,hi im not sure if i am depressed but life just feels kind of shit,"안녕하세요, 제가 우울한지는 잘 모르겠지만, 인생은 그냥 좀 엉망으로 느껴집니다",0,0,0
11,they know i am depressed but they act as though it's just a stupid cry for attention,그들은 내가 우울하다는 것을 알지만 그들은 그것이 단지 관심을 끌기 위한 바보 같은 외침인 것처럼 행동한다,0,0,0
12,usually the normal things i am lonely i have few friends i waaaaaaaaaaaaaaaaaaant a girlfriend etc,보통 나는 외로워 나는 친구가 거의 없어 나는 여자친구 등등,0,0,0
13,my family is really worried about this situation tbh and i really feel sad about it,우리 가족은 이 상황에 대해 정말 걱정하고 있고 나는 그것에 대해 정말 슬프다,0,0,0
14,worst of all is i am sad about that but i am also ok with it,가장 나쁜 것은 내가 그것에 대해 슬프지만 나는 또한 그것에 대해 괜찮다,0,0,0
15, the other way i explain it is you don't just feel sad you feel fucking tired,내가 설명하는 다른 방식은 네가 그냥 슬프지 않다는 거야 빌어먹을 피곤함을 느낀다는 거야,0,0,0
16,barely anything will makr me feel sad for anyone else,거의 그 어떤 것도 나를 다른 누군가에게 슬프게 할 것이다,0,0,0
17,i mean i haven't actually told my boyfriend that i think i am depressed or that i have selfesteem issues and he doesn't suspect a thing,내 말은 내 남자친구에게 내가 우울하거나 자존감 문제가 있고 그는 아무것도 의심하지 않는다고 실제로 말하지 않았다는 것이다,0,0,0
18,lately i've found that i am unhappy with where i am at in my job and personal relationships,최근에 나는 내 직업과 개인적인 관계에서 내가 처한 상황이 불만족스럽다는 것을 발견했다,0,0,0
19,and of course i failed why else will i be here see i don't have a lot of friends and i often feel lonely,그리고 물론 나는 실패했다. 그렇지 않으면 왜 내가 여기에 있을 것인가? 나는 친구가 많지 않고 종종 외로움을 느낀다,0,0,0
20,i am still anxious about it as any one would be but not nearly as much as i was and now i just feel depressed about it,나는 여전히 누군가처럼 그것에 대해 불안하지만 예전만큼은 아니지만 지금은 그것에 대해 우울할 뿐이다,0,0,0
21,i point to myself as an example of how adopted kids can turn out okay but i am depressed suicidal and a financial and emotional burden on my family,"나는 입양된 아이들이 어떻게 잘 될 수 있는지에 대한 예로 나 자신을 지목하지만 나는 자살로 우울하고 내 가족에게 재정적, 정서적 부담이 된다",0,0,0
22,she was the only one who knew i am depressed and bi polar and i told her i was cutting and she read the poems i wrote,그녀는 내가 우울하고 양극단이라는 것을 아는 유일한 사람이었고 나는 그녀에게 내가 베고 있다고 말했고 그녀는 내가 쓴 시를 읽었다,0,0,0
23,i have notices that it is easier to overcome when i feel depressed and tonight is the first night i've felt depressed for a while,나는 내가 우울할 때 극복하기가 더 쉽다는 것을 알아차렸고 오늘 밤은 내가 한동안 우울했던 첫 번째 밤이다,0,0,0
24,i am depressed and suffering right now not because i wasn't able to 'soldier through it' or just shake off the pain like it was nothing,나는 지금 우울하고 고통스러워요. 내가 '그것을 극복할 수 없어서' 혹은 아무것도 아닌 것처럼 고통을 떨쳐버릴 수 없어서가 아니에요,0,0,0
25,i am depressed because im lonely and ashamed of myself,나는 내 자신이 외롭고 부끄러워서 우울하다,0,0,0
26,exatctly and for me the meaning will never be met and i guess thats why i am saddened about others who dont meet it,정확하게 그리고 나에게 그 의미는 결코 충족되지 않을 것이고 그것이 내가 그것을 충족시키지 못하는 다른 사람들에 대해 슬퍼하는 이유인 것 같다,0,0,0
27,when i was younger they kind of did made me feel something but now im too damn numb i only feel sadness and self hate,내가 더 어렸을 때 그들은 나에게 무언가를 느끼게 했지만 지금은 너무 무감각해서 슬픔과 자기 혐오만 느낄 뿐이다,0,0,0
28,if you ever feel lonely buzz me on facebook dacheng chengers gu,만약 당신이 외롭다고 느낀다면 페이스북에 전화해 주세요,0,0,0
29,to be honest i am not even fucking sure whether i am depressed or not as i haven't officially had it diagnosed,솔직히 나는 공식적으로 진단을 받지 않았기 때문에 내가 우울한지 아닌지조차 확신할 수 없다,0,0,0
30,i very often feel sad hopeless anxious and incredibly frustrated,나는 매우 자주 슬픈 절망적인 불안과 믿을 수 없을 정도로 좌절감을 느낀다,0,0,0
31,there's a lot of reasons as to why i am depressed but mostly because my dad has no sympathy to how i feel and my mom is the same,내가 우울한 이유에는 여러 가지 이유가 있지만 대부분은 아빠가 내 기분에 공감하지 않고 엄마도 똑같기 때문이다,0,0,0
32,i wouldn't even say i am depressed i lack motivation,나는 심지어 내가 우울하다고 말하지 않을 것이다. 나는 동기가 부족하다,0,0,0
33,i know i am sad but don't know why and sometimes it feel like i am sad about nothing,나는 내가 슬프다는 것을 알지만 왜 그런지 모르겠다 그리고 가끔은 내가 아무것도 아닌 것에 대해 슬퍼하는 것처럼 느껴진다,0,0,0
34,even when i am in a typically better mood than normal i still feel sad,심지어 내가 보통 때보다 전형적으로 더 좋은 기분일 때도 나는 여전히 슬프다,0,0,0
35,you sound depressed and think you feel depressed,당신은 우울하게 들리고 당신이 우울하다고 생각한다,0,0,0
36,i am depressed and have been studying for a huge test,나는 우울하고 큰 시험을 위해 공부하고 있다,0,0,0
37,feeling are also numb its a dark feeling of emptiness sometimes to the point where i cannot even feel sadness its so confusingly bad id be happy to feel sadness,느낌 또한 무감각하다 때때로 나는 슬픔조차 느낄 수 없을 정도로 어두운 공허감을 느낀다 너무 혼란스러울 정도로 나는 슬픔을 느끼는 것이 행복하다,0,0,0
38,i have finally came to terms with the fact that i am depressed i am a  year old guy and i hate my life,나는 마침내 내가 우울하다는 사실을 받아들였다. 나는 한 살짜리 남자이고 나는 내 삶이 싫다,0,0,0
39,i don't feel i can say i am depressed as i am only  and what i am feeling pretty much constantly is quite possibly just hormones,나는 내가 우울하다고 말할 수 있다고 생각하지 않는다. 그리고 내가 거의 항상 느끼는 것은 아마도 단지 호르몬일 것이다,0,0,0
40,petty sure i am depressed at first that made me feel like i was wrong,내가 처음에는 내가 틀렸다는 느낌이 들 정도로 우울해,0,0,0
41,usually when i am depressed it just a few mutters filled with various forms of the word fuck with an occasional topical word,보통 내가 우울할 때 그것은 가끔 주제어와 함께 fuck이라는 단어의 다양한 형태로 가득 찬 몇 마디 중얼거릴 뿐이다,0,0,0
42,once i get up it usually takes like min for me to feel normal but dont get me wrong i am depressed but i hate that morning helpless feeling,일단 일어나면 보통 내가 정상이라고 느끼는 데는 나처럼 시간이 걸리지만 오해하지는 마 나는 우울하지만 나는 그날 아침 무력한 느낌이 싫다,0,0,0
43,regardless i am sad and boring and i have no one to talk to,그럼에도 불구하고 나는 슬프고 지루하며 대화할 사람이 없다,0,0,0
44,gt i feel depressed even tho i should be the happiest guy alive,나는 내가 세상에서 가장 행복한 사람이어야 하는데도 우울하다,0,0,0
45,they know when i am sad and they come sit on me or head butt me and everything feels a little easier to bear,그들은 내가 슬플 때 내게 앉거나 머리를 부딪쳐 모든 것이 조금 더 견디기 쉽다는 것을 안다,0,0,0
46,i told him i am depressed but that's it,나는 그에게 내가 우울하다고 말했지만 그게 다야,0,0,0
47,you don't have to feel lonely when you're comfortable with yourself,당신이 당신 자신에게 편안할 때 당신은 외로움을 느낄 필요가 없다,0,0,0
48,whenever i feel really shit and say to myself that i am depressed and need help it feels like a lie a cry for attention,내가 정말 기분이 좋지 않을 때마다 나는 우울하고 도움이 필요하다고 스스로에게 말할 때마다 그것은 거짓말처럼 느껴져 관심을 끌기 위한 외침이다,0,0,0
49,it's hard to explain it all but essentially i am sad now so i can push myself and be happy later in life,모든 것을 설명하는 것은 어렵지만 본질적으로 나는 지금 슬퍼서 나 자신을 밀어내고 나중에 행복해질 수 있다,0,0,0
50,im not a doctor but whenever i am sad i feel like crap and feel like dying,나는 의사는 아니지만 슬플 때마다 쓰레기처럼 느껴지고 죽고 싶어,0,0,0
51,yup i am depressed,응 나는 우울해,0,0,0
52,i am sad that i took that second quiz and gave me a summary of what i already know but will only give me more details if i buy it,나는 그 두 번째 퀴즈를 봤고 내가 이미 알고 있는 것에 대한 요약을 내게 준 것이 슬프다. 하지만 내가 그것을 산다면 더 많은 세부사항만 줄 것이다,0,0,0
53,it can be a couple things try a hobby or even making new friends i know it's difficult sometimes  but send me a message next time you feel lonely,취미를 시도하거나 새로운 친구를 사귀는 것은 몇 가지가 될 수 있다. 가끔은 어렵다는 것을 알지만 다음에 외로울 때 나에게 메시지를 보내라,0,0,0
54,that's the only time i ever feel depressed,그때가 내가 우울할 유일한 시간이다,0,0,0
55,i just want to be happy more often but feel sad  of the time,나는 단지 더 자주 행복하고 싶지만 그 시간이 슬프다,0,0,0
56,no one deserves to feel depressed and there will always be someone who has it worse,아무도 우울해할 자격이 없고 항상 더 나쁜 사람이 있을 것이다,0,0,0
57,it's also impossible to feel sad while listening to don't stop me now,듣는 동안 슬픔을 느끼는 것도 불가능해 지금 날 막지마,0,0,0
58,even though i feel lonely sometimes i think i am slowly coming to terms with it and accepting that i will never have a girlfriend or someone to love,"비록 나는 때때로 외로움을 느끼지만, 나는 천천히 그것을 받아들이고 내가 결코 여자친구나 사랑할 누군가를 갖지 못할 것이라는 것을 받아들이는 것이라고 생각한다",0,0,0
59, i just want to distract myself and forget that i am sad,나는 단지 내 자신을 산만하게 하고 내가 슬픈 것을 잊고 싶다,0,0,0
60,i want to say i feel depressed but that's a reflexive instinct to name something i just can't understand,나는 우울하다고 말하고 싶지만 그것은 내가 이해할 수 없는 것을 이름 짓는 반사적인 본능이다,0,0,0
61,depression acts as a kind of protection as long as you feel depressed you can't do anything you can't even feel,우울증은 당신이 우울함을 느끼는 한 당신이 느낄 수 없는 어떤 것도 할 수 없는 일종의 보호 역할을 한다,0,0,0
62,however i have started to feel depressed lately,하지만 나는 최근에 우울해지기 시작했다,0,0,0
63, will generally be more readily accepted than i am very down and i think i am depressed,내가 매우 우울하고 우울한 것보다 일반적으로 더 쉽게 받아들여질 것이다,0,0,0
64, he berates me on a daily basis then screams at me when i fuck up and wonders why i am depressed,그는 매일 나를 비난하고 내가 망칠 때 소리를 지르며 내가 왜 우울한지 궁금해한다,0,0,0
65,longest stretch of my modest life however i had to realize today that i am depressed again,내 겸손한 삶의 가장 긴 시간 그러나 나는 오늘 내가 다시 우울하다는 것을 깨달아야 했다,0,0,0
66,i live online normally  i watch funny videos  news  browse reddit  and i acknowledge i am depressed and that's it,나는 보통 온라인으로 산다. 나는 재미있는 비디오 뉴스를 본다. 그리고 나는 내가 우울하다는 것을 인정한다. 그리고 그게 다이다,0,0,0
67,i feel depressed a lot and i feel like i am just drifting away from my friends,나는 우울함을 많이 느끼고 친구들로부터 그냥 떠도는 것 같다,0,0,0
68,however the worst is though i feel depressed about all of this i also feel tremendously guilty and spoiled about this depression,"하지만 최악은 내가 이 모든 것에 대해 우울함을 느끼지만, 나는 또한 이 우울함에 대해 엄청난 죄책감과 응석을 받는다",0,0,0
69,i am depressed i hate myself,나는 우울해 나는 내 자신이 싫어,0,0,0
70,i mean i doubt i am depressed compared to other stories on here it just sounds like i am an entitled douchebag,내 말은 내가 여기에 있는 다른 이야기들에 비해 우울한지 의심스럽다는 것이다. 그것은 내가 자격이 있는 얼간이처럼 들린다,0,0,0
71,i am depressed because of the way i cope with cptsd long term interpersonal trauma and because of how people treated me,나는 cptsd의 장기적인 대인관계 외상에 대처하는 방식과 사람들이 나를 대하는 방식 때문에 우울하다,0,0,0
72,the cycle always ends the same i am sad,사이클은 항상 똑같이 끝나 나는 슬프다,0,0,0
73,like it's my fault i am depressed and im not strong enough to handle basic things in life,마치 내 잘못인 것처럼 나는 우울하고 삶의 기본적인 것들을 다룰 만큼 충분히 강하지 않다,0,0,0
74,i am sad because i am lonely and bored but my sadness makes me stay lonely and bored,나는 외롭고 지루해서 슬프지만 나의 슬픔은 나를 외롭고 지루하게 만든다,0,0,0
75,i am lonely as fuck yet when i have the possibility to socialize my stomach turns upside down and my whole body tells me to not do it,사회화할 수 있는 가능성이 내 배가 뒤집히고 온몸이 하지 말라고 할 때 나는 아직도 외롭다,0,0,0
76,the few friends i had are gone and they weren't people i would trust enough to tell i am depressed anyway,내가 가졌던 몇 안 되는 친구들은 떠났고 그들은 내가 어쨌든 우울하다고 말할 만큼 믿을 만한 사람들이 아니었다,0,0,0
77,i am fully aware that i am depressed and that i bring myself down by thinking negatively but i still can't seem to shake that pessimistic feeling,나는 내가 우울하다는 것과 부정적으로 생각함으로써 나 자신을 우울하게 만든다는 것을 충분히 알고 있지만 여전히 그 비관적인 감정을 떨쳐버릴 수 없는 것 같다,0,0,0
78,i feel sad and anxious and overwhelmed and sometimes like i want to give up before i even start,나는 슬프고 불안하고 벅차며 때때로 시작도 하기 전에 포기하고 싶어,0,0,0
79,after mental training someone close to me died i am sad but i enjoyed our time together and my grief will pass,정신 훈련 후 가까운 사람이 죽어서 슬프지만 나는 우리의 시간을 즐겼고 나의 슬픔은 지나갈 것이다,0,0,0
80,i am depressed about not having friends that are girls i am a good looking guy but i struggle connecting with people,나는 여자인 친구가 없어서 우울해. 나는 잘생긴 남자지만 사람들과 연결되기가 힘들어,0,0,0
81,when i am sad the tears may not always come but inside i am rotting,내가 슬플 때 눈물은 항상 오지 않을 수 있지만 내 안은 썩고 있다,0,0,0
82,i feel depressed is the most i can ever get out but that is wholly insufficient and no one hears what i am trying to say,나는 내가 빠져나갈 수 있는 가장 우울함을 느끼지만 그것은 완전히 불충분하고 아무도 내가 말하려고 하는 것을 듣지 못한다,0,0,0
83,i used to feel sadness disappointment stress anger but now it all is just a blur,나는 슬픔 실망 스트레스 분노를 느끼곤 했지만 지금은 모든 것이 흐릿하다,0,0,0
84,i am torn between thinking that i am depressed and thinking that i am just faking it,나는 내가 우울하다고 생각하는 것과 내가 그것을 속이고 있다고 생각하는 것 사이에서 고민하고 있다,0,0,0
85,they have no clue that i am depressed or afraid of anything,그들은 내가 우울하거나 두려워하는 것을 전혀 모른다,0,0,0
86,it's perfectly fine to feel lonely and depressed,외롭고 우울한 것은 완벽하게 괜찮다,0,0,0
87,i feel depressed because i have this strange notion that the world is passing me by and i am somehow fucking up in a way i can't seem to identify,나는 세상이 나를 지나치고 있다는 이상한 생각을 가지고 있고 내가 식별할 수 없는 것처럼 보이는 방식으로 어떻게든 엉망이 되고 있기 때문에 우울하다,0,0,0
88,i find that when i am depressed or feel low while on my medication it helps to have a project something to have momentum with,나는 내가 약을 복용하는 동안 우울하거나 기분이 나쁠 때 무언가 추진력을 가질 수 있는 프로젝트를 갖는 것이 도움이 된다는 것을 발견한다,0,0,0
89,many feel sad when times are good,많은 사람들은 좋은 때에 슬퍼한다,0,0,0
90,i feel lonely when i am alone but i also feel alone when i am crowded,나는 혼자 있을 때 외롭지만 붐빌 때도 혼자 있다,0,0,0
91,the friendship saved me i havent had many sad feelings or thought and i didnt feel depressed at all when i talked or wrote with her,우정은 나를 구해주었고 나는 많은 슬픈 감정이나 생각을 해본 적이 없었고 나는 그녀와 이야기하거나 글을 쓸 때 전혀 우울하지 않았다,0,0,0
92,i indulge myself with the fantasy that i am lonely and apathetic by choice,나는 선택에 의해 외롭고 무관심하다는 환상에 빠져든다,0,0,0
93,tldr i am depressed my girlfriend has been talking to another guy a lot i am scared of losing her,tldr 나는 우울해 내 여자친구는 다른 남자와 대화를 많이 해서 그녀를 잃을까 봐 두려워,0,0,0
94,i read when i am depressed,나는 우울할 때 책을 읽는다,0,0,0
95,especially my mom who i don't think even knows i am depressed right now i don't want that to happen again,특히 내가 지금 우울한 줄도 모르는 엄마는 그런 일이 다시는 일어나지 않았으면 좋겠어,0,0,0
96,i told them i wanted help with school and that i am sad a lot,나는 그들에게 학교에 도움을 받고 싶다고 말했고 나는 매우 슬프다고 말했다,0,0,0
97,there are things i know i should feel sad about and things that i know i should cry over,내가 슬퍼해야 할 것들과 내가 울어야 할 것들이 있다는 것을 안다,0,0,0
98,when i am depressed usually the only two things that end it are sleep or having to talk to people and i never want to do that when i am bummed,내가 우울할 때 그것을 끝내는 유일한 두 가지는 잠 또는 사람들과 대화하는 것이고 나는 내가 우울할 때 절대 그러고 싶지 않다,0,0,0
99,it's still possible to feel depressed,여전히 우울할 수 있다,0,0,0
100,i've been talking to a therapist and my boyfriend but after admitting that i am depressed it had just gotten worse,나는 치료사와 내 남자친구와 이야기해 왔지만 내가 우울하다는 것을 인정한 후 그것은 더 악화되었다,0,0,0
101,i might feel lonely because i kinda try to avoid social events,나는 사회적인 행사를 피하려고 노력하기 때문에 외로울 수도 있다,0,0,0
102,i feel sad but i don't if i am really actually depressed,나는 슬프지만 내가 정말로 우울한지는 모르겠다,0,0,0
103,i am depressed and all i have been doing for the past week is crying,나는 우울하고 지난 일주일 동안 내가 한 모든 것은 우는 것이다,0,0,0
104,i graduated college make decent money have a loving gf and own my own place yet i feel unhappy,나는 대학을 졸업했고 괜찮은 돈을 벌었고 사랑스러운 여자친구가 있고 내 집을 소유하고 있지만 나는 불행하다,0,0,0
105,its hard for people to grasp that no i don't wanna feel sad and yes i try to think happier but it just doesn't work,"사람들이 이해하기 어려워요. 아니요, 슬퍼하고 싶지 않아요. 그리고 네, 더 행복하게 생각하려고 노력하지만 소용이 없어요",0,0,0
106,you're way more lucid than i am when i am depressed,내가 우울할 때 너는 나보다 훨씬 더 명석하다,0,0,0
107,so every time i feel lonely and depressed or hurt hy her cancelling plans to go out and do something i feel selfish greedy like a brat,그래서 내가 외롭고 우울하거나 그녀의 계획을 망칠 때마다 나는 밖에 나가서 무언가를 할 계획을 취소할 때마다 나는 어린아이처럼 이기적인 욕심을 느낀다,0,0,0
108,but i think my life is unsatisfying because i am depressed,하지만 나는 우울하기 때문에 내 삶이 만족스럽지 않다고 생각한다,0,0,0
109,no one would know i am depressed,아무도 내가 우울하다는 것을 모를 것이다,0,0,0
110,i have lots of friends and i have fun but i feel lonely and sad afterwards wondering when it's gonna happen again,"나는 많은 친구들이 있고 재미있지만, 언제 다시 그런 일이 일어날지 궁금해 후에 외롭고 슬프다",0,0,0
111,i am home now and i feel like shiti am lonely,나는 지금 집에 있고 나는 정말 외롭다,0,0,0
112,i realized my unhappiness is not coz am lonely but more to do with my low self image i have that stops me from stepping out of the house,나는 내 불행이 외롭기 때문이 아니라 집 밖으로 나가는 것을 막는 나의 낮은 이미지와 더 관련이 있다는 것을 깨달았다,0,0,0
113,i know i should feel sad angry and a lot of other things but nothing,나는 내가 화가 나서 슬프고 다른 많은 것들을 느껴야 한다는 것을 알지만 아무것도 아니다,0,0,0
114,for me i can't live up to relationship expectations when i am depressed,나는 우울할 때 관계에 대한 기대에 부응할 수 없다,0,0,0
115,i don't stay in bed all day or anything severe but i just feel like i am sad about myself and my life everyday,나는 하루 종일 침대에 있거나 심각한 것은 아니지만 매일 나 자신과 내 삶에 대해 슬퍼할 뿐이다,0,0,0
116,hi well i dont know where to start other than saying i am depressed,"안녕하세요, 우울하다고 말하는 것 말고는 어디서부터 시작해야 할지 모르겠어요",0,0,0
117,he will have a positive smiling conversation with me about something while i am sad to the point i could cry,그는 내가 울 정도로 슬플 때 나와 무언가에 대해 긍정적인 미소를 지으며 대화할 것이다,0,0,0
