idx,text,translated,cnt,weakest_cnt,strongest_cnt
1043,i am interested in this question because while i am depressed this hasn't been a principal factor in my case,나는 이 질문에 관심이 있다. 왜냐하면 내가 우울한 동안 이것이 내 경우에 주요 요인이 되지 않았기 때문이다,0,0,0
1044,i get anxious around people i am depressed and i never had a girlfriend because of this people bully me about being a virgin,나는 사람들 주변에서 불안하다. 나는 우울하고 이 사람들 때문에 여자친구가 한 번도 없었다. 왜냐하면 이 사람들은 나를 처녀라고 괴롭히기 때문이다,0,0,0
1045,do i just walk into a hospital and say i am depressed it's such an overused word barely anyone takes it seriously,그냥 병원에 들어가서 우울하다고 말하는 건가요? 그것은 너무 많이 사용되는 단어입니다. 거의 아무도 심각하게 받아들이지 않습니다,0,0,0
1046,i just cant focus on school work when i feel sad and depressed and almost suicidal every second of my life,나는 내 삶의 매 순간 슬프고 우울하고 거의 자살할 때 학교 공부에 집중할 수 없다,0,0,0
1047,i've always felt the same about winter and am depressed every winter,나는 겨울에 대해 항상 똑같이 느꼈고 매년 겨울 우울하다,0,0,0
1048,for a while now i have been trying to find a way to describe what happens to me when i begin to feel depressed dealing with anxiety and depression,한동안 나는 불안과 우울증을 다루는 데 우울해지기 시작할 때 나에게 일어나는 일을 묘사하는 방법을 찾으려고 노력해왔다,0,0,0
1049,today though i feel lonely and sad,오늘은 외롭고 슬프지만,0,0,0
1050,i feel sad and lonely,나는 슬프고 외롭다,0,0,0
1051,whenever i am alone i start to feel depressed,나는 혼자 있을 때마다 우울해지기 시작한다,0,0,0
1052,for some like me i am lonely even in a crowd of friends and family,나와 같은 몇몇 사람들에게 나는 친구들과 가족들의 군중 속에서도 외롭다,0,0,0
1053,every day i am sad but i ignore it,매일 나는 슬프지만 무시한다,0,0,0
1054,as i said when i listen to upbeat songs when i am sad i feel like it's only pushing away the sadness but it's still there,내가 말했듯이 내가 슬플 때 낙관적인 노래를 들을 때 나는 그것이 슬픔을 밀어내는 것처럼 느끼지만 그것은 여전히 거기에 있다,0,0,0
1055,it's okay to feel lonely,외로워도 괜찮아,0,0,0
1056,do you think i want to feel sad do you think i enjoy not being happy if i could snap my finger and make this sadness anxiety etc,당신은 내가 슬퍼하고 싶어한다고 생각합니까? 내가 손가락을 부러뜨리고 슬픔을 불안하게 할 수 있다면 행복하지 않은 것을 즐긴다고 생각합니까,0,0,0
1057,i feel i am depressed for about  years,나는 내가 약 몇 년 동안 우울하다고 느낀다,0,0,0
1058,just a few days ago i suddenly began to feel depressed again but for no real reason,불과 며칠 전에 나는 갑자기 다시 우울해지기 시작했지만 진짜 이유는 없었다,0,0,0
1059,even when i am happy i am sad underneath,내가 행복할 때 조차도 나는 그 밑에서 슬프다,0,0,0
1060,i am depressed and suicide seems like an option,나는 우울하고 자살은 선택인 것 같다,0,0,0
1061,i am depressed and on lexapro but i am not here to talk about myself,나는 우울하고 렉사프로를 하고 있지만 내 이야기를 하러 온 것은 아니다,0,0,0
1062,the weird thing is that i feel depressed for no reason,이상한 것은 내가 이유 없이 우울하다는 것이다,0,0,0
1063,i am lonely and a sociopath,나는 외롭고 소시오패스이다,0,0,0
1064,i build up the courage to tell them i am unhappy but i always bottle it and just tell them i am fine as i don't want to upset them,"나는 그들에게 내가 불행하다고 말할 용기를 기르지만, 나는 항상 그것을 포기하고 그들을 화나게 하고 싶지 않기 때문에 괜찮다고 말한다",0,0,0
1065,i say i am depressed simply because i display all of the systems of depression and because i lack a better descriptor,나는 단순히 내가 우울증의 모든 시스템을 보여주고 더 나은 설명자가 부족하기 때문에 우울하다고 말한다,0,0,0
1066,i am lonely here,나는 여기서 외롭다,0,0,0
1067,i feel lonely beyond belief,나는 믿을 수 없을 정도로 외롭다,0,0,0
1068,when i am depressed my desktop comp gets about five percent usage of normal,내가 우울할 때 내 데스크톱 컴퓨터는 정상적인 사용의 약 5%를 차지한다,0,0,0
1069,i don't have any friends to turn to that's one of the reasons why i am depressed,내가 우울한 이유 중 하나는 의지할 친구가 없다는 것이다,0,0,0
1070,what about i don't really feel sad anyway,어쨌든 나는 정말 슬프지 않다,0,0,0
1071,i f feel like i am depressed but i tell myself that i don't have a reason to be and that i am just being a spoiled brat,"만약 내가 우울하다고 느끼면, 하지만 나는 내가 될 이유가 없고 단지 버릇없는 아이가 되고 있다고 스스로에게 말한다",0,0,0
1072,hi i am also in college and am depressed,안녕 나도 대학생이고 우울해,0,0,0
1073,i'm realizing more and more that i am depressed and that i need help but i have no idea how to go about doing it,나는 내가 우울하고 도움이 필요하다는 것을 점점 더 깨닫고 있지만 어떻게 해야 할지 모르겠다,0,0,0
1074,upon receiving the news each time i've been unable to cry or feel sad,매번 그 소식을 듣자마자 나는 울거나 슬퍼할 수 없었다,0,0,0
1075,if i am depressed i get more depressed if i am happy i get happier etc,내가 우울하면 더 우울해지고 행복하면 더 행복해지는 등,0,0,0
1076,it's late i am sad and i just want to know people understand and that there is hope,늦었지만 나는 슬프고 나는 단지 사람들이 이해하고 희망이 있다는 것을 알고 싶다,0,0,0
1077,when i feel sad i kind of want to force myself to cry but i can't because depression isn't just sadness,내가 슬플 때 나는 억지로 울고 싶지만 우울증이 단지 슬픔이 아니기 때문에 그럴 수 없다,0,0,0
1078,keep a log of what's stressing you what's making you feel depressed etc,무엇이 당신을 우울하게 하는지 등을 당신에게 스트레스를 주는 것을 기록하세요,0,0,0
1079,it doesn't help that i am depressed and suicidal,내가 우울하고 자살하는 것은 도움이 되지 않는다,0,0,0
1080,'i am depressed,나는 우울하다,0,0,0
1081,as i just said i am unhappy regardless of context,내가 방금 말했듯이 나는 문맥에 상관없이 불행하다,0,0,0
1082,this happens all the time but for the past few months i've been in a bad mood and i am sad all the time,이런 일은 항상 일어나지만 지난 몇 달 동안 나는 기분이 좋지 않았고 항상 슬프다,0,0,0
1083,when i think about why i am depressed i don't even know why,내가 왜 우울한지 생각할 때 나는 왜 그런지도 모른다,0,0,0
1084,i feel lonely without them but i want nothing more than to get away when i am with them,나는 그들이 없으면 외롭지만 그들과 함께 있을 때 나는 떠나는 것 외에는 아무것도 원하지 않는다,0,0,0
1085,why do i feel lonely feel like burden to others,왜 나는 외로움을 느낄까 다른 사람들에게 짐처럼 느껴진다,0,0,0
1086,i am lonely as fuck and it's  am west coast,나는 빌어먹을 외롭고 그곳은 서해안이다,0,0,0
1087,im starting to feel depressed again and schools coming up,나는 다시 우울해지기 시작하고 학교가 곧 다가온다,0,0,0
1088,this is an entirely reasonable desire and it's understandable that you would feel sad if your needs for connection and nurturing are not being met,이것은 전적으로 합리적인 욕구이며 연결과 양육에 대한 당신의 요구가 충족되지 않는다면 당신이 슬퍼할 것이라는 것은 이해할 수 있다,0,0,0
1089,i felt myself all around great and first time in  years i didn't feel depressed,저는 제 자신이 훌륭하다고 느꼈고 몇 년 만에 처음으로 우울함을 느끼지 않았습니다,0,0,0
1090,so many people who while for different reasons feel depressed,다른 이유로 우울해 하는 많은 사람들,0,0,0
1091,i also don't think that anyone really needs a reason exactly to feel depressed,나는 또한 아무도 우울함을 느끼기 위해 정확한 이유가 필요하다고 생각하지 않는다,0,0,0
1092,i am depressed because i am lonely and i am lonely because i am depressed,나는 외로워서 우울하고 우울해서 외롭다,0,0,0
1093,i feel sad for no apparent reason and that's the worst kind of sadness because you don't know how to fix it,나는 뚜렷한 이유 없이 슬프고 그것은 네가 그것을 고치는 방법을 모르기 때문에 최악의 종류의 슬픔이다,0,0,0
1094,how did i fuck this up i wonder if he'll call me again i am sad because i actually liked someone for the first time in a while,내가 어떻게 이걸 망쳤을까 나는 그가 나에게 다시 전화할까 궁금해 나는 슬퍼 왜냐하면 나는 실제로 오랜만에 누군가를 좋아했기 때문이다,0,0,0
1095,i do have a boyfriend who is super great about this but just doesn't understand why i am sad,나는 이것에 대해 매우 훌륭하지만 내가 왜 슬픈지 이해하지 못하는 남자친구가 있다,0,0,0
1096,be honest with yourself and if you feel sad then that's just how you feel,자신에게 정직하고 슬프면 그게 바로 당신이 느끼는 감정이다,0,0,0
1097,i am angry i am sad i am lonely i hate life i love life but i know i am not enjoying it,나는 화가 난다 나는 슬프다 나는 외롭다 나는 삶이 싫다 나는 삶을 사랑하지만 나는 내가 그것을 즐기고 있지 않다는 것을 안다,0,0,0
1098,i am sad and sometimes happy,나는 슬프고 가끔은 행복하다,0,0,0
1099,it's normal to feel sad when you go through a breakup,이별을 겪을 때 슬픔을 느끼는 것은 정상이다,0,0,0
1100,i feel like the biggest reason i am depressed is because of my past,내가 우울한 가장 큰 이유는 내 과거 때문인 것 같다,0,0,0
1101,i feel lonely and just want to cry but nothing i do can make me,나는 외롭고 울고 싶지만 내가 할 수 있는 일은 아무것도 없다,0,0,0
1102,at this point everyone close to me knows i am depressed or sorta deals with stuff,이 시점에서 나와 가까운 모든 사람들은 내가 우울하거나 무언가를 다루는 것을 안다,0,0,0
1103,we are all just humans and we feel happy and we feel sad,우리는 모두 그저 인간이고 행복하고 슬프다,0,0,0
1104,they know i am quiet and struggle to interact like other people but still no one knows i am depressed,그들은 내가 조용하고 다른 사람들처럼 상호작용하기 어렵다는 것을 알지만 여전히 아무도 내가 우울하다는 것을 모른다,0,0,0
1105,'how are you' i am lonely and miserable,'어떻게 지내니' 나는 외롭고 비참해,0,0,0
1106,if i go around telling everyone that i am depressed not only does it lose its meaning people look down on me,만약 내가 모든 사람들에게 내가 우울하다고 말한다면 그것은 사람들이 나를 무시하는 의미를 잃게 될 뿐만 아니라,0,0,0
1107,if a thought comes up that makes you unhappy it's perfectly okay to feel sad or even cry,만약 당신을 불행하게 만드는 생각이 떠오른다면 슬프거나 심지어 울어도 완벽하게 괜찮다,0,0,0
1108,i can't tell anyone that i am depressed because i feel so guilty,나는 죄책감 때문에 우울하다고 아무에게도 말할 수 없다,0,0,0
1109,see i thought it was just me making myself depressed for a while or something you know like i was not meaning to but some how making myself feel depressed,나는 내가 잠시 나 자신을 우울하게 하거나 내가 의도한 것이 아니라 왠지 나 자신을 우울하게 만드는 것처럼 생각했다,0,0,0
1110,i don't even feel depressed really just completely drained of energy or emotion and don't know where else to post this,나는 심지어 정말 우울하지도 않고 단지 에너지나 감정이 완전히 고갈되었고 이것을 어디에 올려야 할지 모르겠다,0,0,0
1111,i know i am depressed but i can't go to therapist because i can't afford it plus i don't even have time for myself now these days,나도 내가 우울하다는 것을 알지만 나는 그것을 감당할 수 없고 심지어 요즘 나 자신을 위한 시간도 없기 때문에 치료사에 갈 수 없다,0,0,0
1112,i have great friends a beautiful girlfriend  i have a kind of guilt like i don't deserve to feel sad about this,나는 좋은 친구들이 있고 아름다운 여자친구가 있다. 나는 이것에 대해 슬퍼할 자격이 없는 일종의 죄책감이 있다,0,0,0
1113,like i am faking it just for attention because i've forgotten why i am sad all the time,내가 왜 항상 슬픈지 잊어버렸기 때문에 내가 관심을 끌기 위해 그것을 가장하는 것처럼,0,0,0
1114,i'd say  of the time i don't actively feel depressed,나는 내가 적극적으로 우울함을 느끼지 않는다고 말하고 싶다,0,0,0
1115,i personally think it helps it's like i set aside a time for myself every week to feel sad and be myself,나는 개인적으로 그것이 도움이 된다고 생각한다. 마치 내가 매주 슬퍼하고 나 자신이 되는 시간을 마련하는 것 같다,0,0,0
1116,tldr i feel lonely sad i hate myself and i don't know if i can take this any longer,tldr 나는 외로워 슬프고 나는 내 자신이 싫어 더 이상 참을 수 있을지 모르겠어,0,0,0
1117,after  meetings he declared that i am depressed,회의 후에 그는 내가 우울하다고 선언했다,0,0,0
1118,i feel depressed all the fucking time and i can't help but feel like that article and so many others about genuine depression apply to me,나는 항상 우울하고 그 기사와 진정한 우울증에 대한 많은 다른 사람들이 나에게 적용되는 것처럼 느끼지 않을 수 없다,0,0,0
1119,and because i feel lonely i constantly seek out a remedy by dating and meeting other people,그리고 나는 외로움을 느끼기 때문에 나는 끊임없이 다른 사람들과 데이트하고 만남으로써 해결책을 찾는다,0,0,0
1120,the wanting to feel depressed imo is a last tipping point before entering an episode,우울한 아이모를 느끼고 싶은 것은 에피소드에 들어가기 전 마지막 티핑 포인트이다,0,0,0
1121,i don't want to feel depressed anymore,나는 더 이상 우울함을 느끼고 싶지 않다,0,0,0
1122,you may feel lonely but you are certainly not alone,"당신은 외로울지도 모르지만, 당신은 확실히 혼자가 아니다",0,0,0
1123,kype theonlyulubai talk to me guy i am lonely too,Kyype 유일한 ulubai가 나에게 말을 건다 남자 나도 외롭다,0,0,0
1124,but only recently has alcohol started to make me feel sad when i drink too much of it,하지만 최근에야 술을 너무 많이 마시면 슬퍼지기 시작했다,0,0,0
1125,it's difficult to know if i am depressed or not too,내가 우울한지 아닌지를 아는 것은 어렵다,0,0,0
1126,i feel depressed because the next school year is gonna be the last,나는 다음 학년이 마지막이 될 것이기 때문에 우울하다,0,0,0
1127,sometimes i feel lonely but a lot of the time i like my own company,가끔 나는 외롭지만 많은 경우 나는 나의 회사를 좋아한다,0,0,0
1128,so i read a lot of posts where people find it hard to sleep because they feel depressed,그래서 나는 사람들이 우울해서 잠을 잘 수 없다는 글을 많이 읽었다,0,0,0
1129,i understand why you did what you did while depression makes us feel lonely and isolated sometimes we feel the urge to push people away too,나는 우울증이 우리를 외롭고 고립되게 만드는 동안 왜 당신이 했는지 이해한다. 우리는 때때로 사람들을 밀어내고 싶은 충동을 느낀다,0,0,0
1130,i hate all of my classes i am lonely and over whelmed,나는 내 모든 수업을 싫어한다. 나는 외롭고 압도당한다,0,0,0
1131,i don't think depression means you're incapable of feeling joy but more so that you feel sad or empty for no reason at all,"나는 우울증이 당신이 기쁨을 느낄 수 없다는 것을 의미한다고 생각하지 않고, 아무 이유 없이 슬프거나 공허함을 느끼게 하는 것을 의미한다고 생각한다",0,0,0
1132,and although i have a girlfriend a loving family and good friends i still feel lonely sometimes and i accept that,그리고 비록 나는 여자친구가 있고 사랑스러운 가족과 좋은 친구들이 있지만 나는 여전히 가끔 외롭고 나는 그것을 받아들인다,0,0,0
1133,occasionally my parents will notice that i am sad but all they do is try to fix it instead of just being there for me,가끔 나의 부모님은 내가 슬프다는 것을 눈치채시겠지만 그들이 하는 모든 것은 단지 나를 위해 그곳에 있는 것 대신에 그것을 고치려고 노력하는 것이다,0,0,0
1134,i am lonely too and if nothing else we can keep each other company,나도 외롭고 다른 것이 없다면 우리는 서로 함께 할 수 있다,0,0,0
1135,sure things have always been bad but i never used to feel lonely,물론 상황은 항상 나빴지만 나는 결코 외로움을 느끼지 않았다,0,0,0
1136,she even told me if i feel depressed at all to talk to her,그녀는 심지어 내가 그녀와 이야기하기 위해 조금이라도 우울하면 나에게 말했다,0,0,0
1137,i am sad and emotional all day every day,나는 하루종일 슬프고 감정적이다,0,0,0
1138,option onestay i am unhappy in college everyday is torture and have stopped attending lectures i may even fail,선택사항 1 나는 대학에서 매일 불행하며 고문이고 심지어 실패할지도 모르는 강의에 참석하는 것을 중단했다,0,0,0
1139,tldr for the tldr i am unhappy,tldr for the tldr 나는 불행하다,0,0,0
1140,she uses her depression as a handle all the time to lean on and complain about everything i am depressed i just want to cry,그녀는 항상 그녀의 우울증을 손잡이로 사용하여 내가 우울한 모든 것에 대해 불평하고 나는 그저 울고 싶다,0,0,0
1141,now i am just sad over the fact that i am sad,지금 나는 내가 슬프다는 사실 때문에 슬플 뿐이다,0,0,0
1142,feel so bland i don't know if i am depressed or just lazy,내가 우울한지 게으른지 너무 싱겁다,0,0,0
1143,i guess the point is i am lonely,요점은 내가 외롭다는 것이다,0,0,0
1144,i worry that i keep losing people and i am lonely,나는 내가 계속 사람들을 잃는 것이 걱정되고 나는 외롭다,0,0,0
1145,now i am depressed that u don't have my garden,지금 나는 네가 내 정원을 가지고 있지 않아서 우울하다,0,0,0
1146,meanwhile i am sad and miss being a part of a cohesive family unit,한편 나는 슬프고 응집력 있는 가족 단위의 일원이 되는 것이 그립다,0,0,0
1147,when i am depressed i tend to let myself get behind on things and sortof slowly start to let my life fall apart,내가 우울할 때 나는 내 자신이 일에 뒤처지게 내버려두는 경향이 있고 내 삶이 서서히 무너지기 시작한다,0,0,0
1148,i think i am depressed but the reasons for my depression are different than the majority i assume,나는 내가 우울하다고 생각하지만 내 우울증의 이유는 내가 생각하는 대다수와 다르다,0,0,0
1149,okay so when i am depressed it's like that's all there is,"좋아, 그래서 내가 우울할 때 그게 다야",0,0,0
1150,i dont necessarily feel sad just empty,나는 단지 공허함만으로 반드시 슬퍼지는 것은 아니다,0,0,0
1151,i just don't want to admit to myself i am depressed because somehow that makes me depressed,나는 단지 내가 우울하다는 것을 스스로 인정하고 싶지 않다. 왜냐하면 그것은 왠지 나를 우울하게 만들기 때문이다,0,0,0
1152,i am  and used to feel depressed on a regular basis to the point where i often thought about i never acted upon these thoughts self harm,나는 이러한 생각들에 대해 결코 행동하지 않았다고 종종 생각할 정도로 정기적으로 우울함을 느끼곤 한다,0,0,0
1153,is this wrong of me in a way even though i am depressed myself i kind of feel like seeking out a girl who's depressed is kind of taking advantage,나 자신이 우울해도 나는 우울한 여자를 찾는 것이 일종의 이점을 취하는 것처럼 느껴진다,0,0,0
1154,i am fat i am lazy i am stupid i am depressed i am alone,나는 뚱뚱해 나는 게을러 나는 멍청해 나는 우울해 나는 혼자야,0,0,0
1155,i am new to this subreddit and new to sharing to people that i am depressed,나는 이 서브레딧이 처음이고 내가 우울하다는 것을 사람들에게 공유하는 것이 처음이다,0,0,0
1156,i would never feel lonely with hallucinations and voices,나는 환각과 목소리로 결코 외롭지 않을 것이다,0,0,0
1157,just one difference i want to clarify i said how not to feel lonely not be lonely,"단지 한 가지 차이점을 분명히 하고 싶은 것이 있는데, 나는 외롭지 않게 느끼는 방법을 말했다",0,0,0
1158,message me if you want someone to chat to i find online friends a lot easier to handle when i am depressed ,만약 당신이 누군가와 채팅하기를 원한다면 나에게 메시지를 주세요. 나는 내가 우울할 때 온라인 친구들을 훨씬 더 다루기 쉽다고 생각합니다,0,0,0
1159,that's how i explain it its irrational and it sucks to feel depressed but its a valid emotion its valid because you feel it and its real,그것이 내가 그것을 설명하는 방법이다. 그것은 비이성적이고 우울함을 느끼는 것은 역겹지만 유효한 감정이다. 왜냐하면 당신은 그것을 느끼고 그것은 진짜이기 때문이다,0,0,0
1160,i started talking to someone at the beginning of the school semester and i've come to the conclusion that i am depressed,나는 학기 초에 누군가와 이야기하기 시작했고 우울하다는 결론에 도달했다,0,0,0
1161,sometimes i am sad sometimes i am angry and occasionally a happy memory will comfort me,때때로 나는 슬프고 때로는 화가나고 때로는 행복한 기억이 나를 위로해줄것이다,0,0,0
1162,i don't know if i am depressed but i am certainly less happy since becoming more selfaware,"나는 내가 우울한지는 모르지만, 더 자각하게 된 이후로 확실히 덜 행복하다",0,0,0
1163,i don't know i just think i am being too dramatic and there isn't a reason for me to feel depressed so maybe i am not,나는 내가 너무 극적이고 내가 우울할 이유가 없다고 생각하는 것을 모르겠다. 그래서 아마도 나는 그렇지 않을 것이다,0,0,0
1164,depression runs in my family and i am not sure if i am depressed,우리 가족은 우울증이 있고 나는 내가 우울한지 확신할 수 없다,0,0,0
1165,it comes to a point where i get more upset about realizing i am depressed again than anything my depression makes me feel,그것은 내 우울증이 나를 느끼게 하는 어떤 것보다 내가 다시 우울하다는 것을 깨닫는 것에 대해 더 화가 나는 지점에 도달한다,0,0,0
1166,the ones i have seen aren't judgemental they are mostly indifferent but sometimes seem to feel sad for you,내가 본 사람들은 판단력이 강하지 않다. 그들은 대부분 무관심하지만 가끔은 너에게 슬퍼하는 것 같다,0,0,0
1167,when i am depressed i have no motivation to do anything,내가 우울할 때 나는 아무것도 할 동기가 없다,0,0,0
1168,i speak from similar experiences and i feel sad that this is happening to you,나는 비슷한 경험을 통해 말하고 너에게 이런 일이 일어나고 있다는 것이 슬프다,0,0,0
1169,for example i am lonely as hell,"예를 들어, 나는 지옥처럼 외롭다",0,0,0
1170, and it makes me feel depressed,그리고 그것은 나를 우울하게 만든다,0,0,0
1171,i carry on on the notion that even though i am unhappy,나는 내가 불행할지라도 그 생각을 계속한다,0,0,0
1172,i continuously fantasize about people finding out that i am depressed so they would care about me,나는 사람들이 내가 우울해서 그들이 나를 신경 쓸 것이라는 것을 알게 되는 것에 대해 계속해서 공상한다,0,0,0
1173,so like i am depressed again,그래서 내가 다시 우울한 것처럼,0,0,0
1174,is wallowing in self putty ever necessary should i will myself to do other things i want to feel sad,필요할 때마다 나는 다른 것들을 할 것이다. 나는 슬프고 싶다,0,0,0
1175,hi my name is evan i am  and i am depressed and now suicidal,안녕 내 이름은 에반이고 나는 우울하고 지금 자살하고 있어,0,0,0
1176,i guess i am embarrassed because there's nothing wrong with my life that's real i just feel sad and down on myself,내 인생에 아무 문제가 없기 때문에 창피한 것 같아. 진짜야. 나는 그저 슬프고 나 자신을 우울하게 느낄 뿐이야,0,0,0
1177,netflix is my friend when i am depressed,넷플릭스는 내가 우울할 때 내 친구이다,0,0,0
