text,translated
i suppose my reaction to it has changed and i am more willing to get out and do something even when i am depressed,나는 그것에 대한 나의 반응이 바뀌었다고 생각하고 내가 우울할 때에도 기꺼이 나가서 무언가를 할 것이다
generally i am unhappy with a lot of things have a general idea of what i want but don't know what to do about it,일반적으로 나는 내가 무엇을 원하는지에 대한 일반적인 생각을 가지고 있지만 그것에 대해 무엇을 해야 할지 모른다
this feeling of love is also super rare and i am sorta worried the next time i feel it i am also gonna feel sad,이 사랑의 감정은 또한 매우 드물고 나는 다음에 그것을 느낄 때 나도 슬퍼질 것 같아 걱정된다
not because i am unconfident or shy but because every time i see happiness i feel sadness,내가 자신감이 없거나 부끄러워서가 아니라 내가 행복을 볼 때마다 나는 슬픔을 느끼기 때문이다
well you don't have to feel lonely,"음, 외롭다고 느낄 필요는 없어"
i haven't met anyone that totally and completely understands me and in a very stupid way that makes me feel lonely as hell,나는 나를 완전히 완전히 이해하고 나를 지옥처럼 외롭게 만드는 매우 바보 같은 방식으로 아무도 만나지 못했다
i can understand about feeling bad because there are so many positives in your life and yet you still feel depressed,나는 기분이 나쁘다는 것에 대해 이해할 수 있다. 왜냐하면 당신의 삶에는 많은 긍정적인 것들이 있지만 당신은 여전히 우울하기 때문이다
i feel as if i know why i am depressed but it's doesn't make sense to me as to why,나는 내가 왜 우울한지 알고 있는 것처럼 느껴지지만 왜 그런지에 대해 나는 이해할 수 없다
there is no reason anyone should feel depressed unless they are actually depressed when they start putting things into perspective beyond their bubble,그들이 자신의 거품을 넘어 사물을 원근법으로 보기 시작할 때 실제로 우울하지 않는 한 누군가가 우울해해야 할 이유는 없다
oh i am depressed it's ok for me to do nothing today,오 나는 우울해 오늘 아무것도 하지 않아도 괜찮아
for more than a year now i have been debating to myself whether or not i am depressed,지금 1년 넘게 나는 내가 우울한지 아닌지 혼자 고민하고 있다
sounds good and if you start to feel lonely  you can always do the same thing at a coffee shop or something,"좋아요, 그리고 만약 당신이 외로움을 느끼기 시작한다면 당신은 커피숍이나 다른 곳에서 항상 같은 것을 할 수 있습니다"
for a past while i've been asking myself if i am depressed or not,한동안 나는 내가 우울한지 아닌지 자문해왔다
i've been starting to feel depressed and every day it seems to just be spiralling worse and worse,나는 우울해지기 시작했고 매일 그것은 점점 더 악화되는 것처럼 보인다
i am unhappy with who i am,나는 내가 누구인지 불행하다
and yes i am depressed and i've managed to continue living and trying bettering myself with some result but i always fuck it up with stuff like this,"그리고 네, 저는 우울해요. 그리고 저는 계속해서 살고 노력해서 어떤 결과를 얻었지만 저는 항상 이런 것들로 그것을 망칩니다"
i am depressed i am occasionally suicidal i've been dumped for the most ridiculous of reasons,나는 우울하다 나는 가끔 자살을 한다 나는 가장 터무니없는 이유로 차였다
a lot of people feel lonely a lot of people feel empty,"많은 사람들이 외로움을 느끼고, 많은 사람들이 공허함을 느낀다"
ever since i am in the special ed program at my high school it has always made me feel depressed about my intelligence at school,"내가 고등학교에서 특수 프로그램을 맡은 이후로, 그것은 항상 나를 학교에서의 나의 지능에 대해 우울하게 만들었다"
i am worth extra attention because i am depressed,나는 우울하기 때문에 더 많은 관심을 기울일 가치가 있다
i am depressed because people know that the system is awful but they perpetuate it,사람들은 시스템이 끔찍하다는 것을 알지만 그들은 그것을 영구화하기 때문에 나는 우울하다
i am depressed because i am a fuck up,나는 기분이 나빠서 우울하다
i am unhappy in this relationship and i want to end it,나는 이 관계가 불행하고 끝내고 싶다
i am sad lonely and home all day,나는 슬프고 외롭고 하루종일 집에 있다
even if it's only something like saying you still feel depressed,비록 그것이 당신이 여전히 우울하다고 말하는 것과 같은 것일지라도
i am back to that place where i am sad or just indifferent and in the state of lowness,나는 슬프거나 그저 무관심하고 낮은 상태에 있는 그곳으로 돌아왔다
i feel that i am depressed without reason and always try to track the source when someone asks why,나는 이유 없이 우울함을 느끼고 누군가가 이유를 물어볼 때 항상 출처를 추적하려고 노력한다
i feel pain sort of i feel sadness sort of i feel happiness,나는 고통을 느낀다. 나는 슬픔을 느낀다. 나는 행복을 느낀다
my opinion on whether i am depressed keeps bouncing back and forth because of this and i am now stuck in a spiral of confusion,내가 우울한지에 대한 나의 의견은 이것 때문에 계속해서 앞뒤로 튕겨지고 나는 지금 혼란의 소용돌이에 갇혀 있다
i'll feel sad and i won't do anything because i am feeling sad,나는 슬플 것이고 슬퍼서 아무것도 하지 않을 것이다
it can feel lonely when you feel you can't talk about your feelings to others,자신의 감정을 다른 사람에게 말할 수 없다고 느낄 때 외로움을 느낄 수 있다
he doesn't get shit i am depressed and he's interpreting it as anger towards him,그는 내가 우울해하고 그는 그것을 그에 대한 분노로 해석하고 있다
i am depressed and that creates a lack of desire a lack of motivation,나는 우울하고 그것은 욕망의 부족과 동기부여의 부족을 만든다
even when i do go to class i can't focus because i am worried about whether or not people can tell i am depressed,심지어 내가 수업에 갈 때도 사람들이 내가 우울하다고 말할 수 있는지에 대해 걱정하기 때문에 나는 집중할 수 없다
they always want to know why i am depressed etc,그들은 항상 내가 왜 우울한지 등을 알고 싶어한다
i begin to feel depressed for no reason then i spiral out of control and react to everything,나는 이유 없이 우울해지기 시작하고 통제를 잃고 모든 것에 반응한다
yet i feel lonely,하지만 나는 외롭다
but still i lay here and feel lonely and talking sometimes doesn't help,하지만 여전히 나는 여기 누워있고 외롭고 가끔 이야기하는 것은 도움이 되지 않는다
i am sad i think,나는 슬프다 나는 생각한다
i can't feel happy for people or feel sad for them,나는 사람들에게 행복을 느낄 수도 없고 그들에게 슬퍼할 수도 없다
sometimes i seek out triggering pictures or posts knowing it will make me feel sad,가끔 나는 그것이 나를 슬프게 할 것이라는 것을 알고 사진이나 게시물을 촉발시키는 것을 찾는다
anyway i find that sometimes when i am lonely that i can just go sit with them,어쨌든 나는 가끔 내가 외로울 때 그들과 함께 가서 앉을 수 있다는 것을 발견한다
maybe that's a sign of depression or maybe i am depressed because not wanting much makes me a weirdo,"아마도 그것은 우울증의 신호일 수도 있고, 많이 원하지 않으면 나를 이상하게 만들기 때문에 우울할 수도 있다"
and i try and get them out but they're now so hugely condensed people think i am full of it and overreacting when i mention i am depressed,그리고 나는 그들을 꺼내려고 노력하지만 그들은 지금 너무 응축되어 있다. 내가 우울하다고 언급하면 사람들은 내가 그것으로 가득 차 있고 과민 반응한다고 생각한다
they probably know i am unhappy just not how severe it is,그들은 아마도 내가 얼마나 심각한지가 아니라 불행하다는 것을 알고 있을 것이다
i am depressed too but at least i'd like to know who i am what i like or what i think,나도 우울하지만 적어도 내가 좋아하는 것이나 생각하는 것은 무엇인지 알고 싶다
i am lonely and have no real friends,나는 외롭고 진정한 친구가 없다
yet i still feel sad inside,하지만 나는 여전히 내면이 슬프다
i am unhappy with almost every aspect of my life,나는 내 삶의 거의 모든 면에 불행하다
dont give up dont feel sad,포기하지마 슬퍼하지마
by being angry i falsely hide the fact that i am depressed,화를 내면서 나는 내가 우울하다는 사실을 거짓으로 숨긴다
my problem lies with the fact that i know that i am depressed i know what i have to do to solve kick this,내 문제는 내가 우울하다는 것을 알고 있다는 사실에 있다. 나는 이것을 해결하기 위해 내가 무엇을 해야 하는지 안다
it's a selffulfilling prophecy of being alone because i am depressed and depressed because i am alone,내가 혼자이기 때문에 우울하고 혼자이기 때문에 혼자라는 것에 대한 자기 충족적인 예언이다
i've always struggled with eating when i am depressed,나는 우울할 때 항상 먹는 것에 어려움을 겪어왔다
it's not even like i should feel sad,내가 슬퍼해야 할 것 같지도 않다
i feel depressed but it might just be situational,나는 우울하지만 상황적일 수도 있다
that's why i am sad because i don't know what to do,그게 내가 슬픈 이유야 왜냐하면 나는 무엇을 해야 할지 모르기 때문이야
i should feel sad or angry,나는 슬프거나 화가 나야 한다
i know they told me not to take this if i am depressed,나는 그들이 내가 우울하면 이것을 가져가지 말라고 했다는 것을 안다
i hate myself and my body so much that i am depressed all the time and i find some solace while exercising,나는 나 자신과 내 몸이 너무 싫어 항상 우울하고 운동하면서 위안을 찾는다
i feel sad and depressed ,나는 슬프고 우울하다
normally when i am depressed i cry myself to sleep,보통 나는 우울할 때 울어서 잠이 든다
i guess i would say i am lonely and would like to have people to talk to or someone to love,나는 내가 외롭고 대화할 사람이나 사랑할 사람이 있었으면 좋겠다고 말할 것 같다
because it's being around people who don't understand that makes me feel lonely,왜냐하면 이해하지 못하는 사람들 주변에 있는 것이 나를 외롭게 하기 때문이다
overall i know why i am depressed,전반적으로 나는 내가 왜 우울한지 안다
whenever i am depressed and only when i am depressed it's like i feel i need more space in my head,내가 우울할 때마다 그리고 내가 우울할 때만 내 머리에 더 많은 공간이 필요하다고 느끼는 것 같다
not taking my adderall makes me feel depressed lonely and i just want to cry,내 아들을 데려가지 않는 것은 나를 외롭게 우울하게 만들고 나는 그저 울고 싶을 뿐이다
i am lonely and i want something to help motivate me and have a better view of the future because i just don't have it in me anymore,나는 외롭고 나에게 동기를 부여하고 미래를 더 잘 보는 데 도움이 되는 무언가를 원한다. 왜냐하면 나는 더 이상 그것을 가지고 있지 않기 때문이다
i think it may largely be i am lonely and scared,내 생각에는 대체로 내가 외롭고 두려울 수도 있다
so to sum it up i am depressed and there's nothing i can do about it,그래서 요약하자면 나는 우울하고 그것에 대해 내가 할 수 있는 것은 아무것도 없다
i just feel lonely,나는 그냥 외로워
i am depressed because i don't have any friends,나는 친구가 없어서 우울하다
i hug her at night when i am lonely and miserable,나는 외롭고 비참한 밤에 그녀를 껴안는다
if you tell your doctor you feel depressed without external cause you're almost certain to be diagnosed with depression,만약 당신이 당신의 의사에게 외적인 원인 없이 우울하다고 말한다면 당신은 우울증 진단을 받을 것이 거의 확실하다
i've been so depressed all weekend and i am depressed enough on a normal day that i am just really sick of this,나는 주말 내내 너무 우울했고 정상적인 날에는 충분히 우울해서 이것에 정말 질렸다
i used to try my best to laugh it off when i am depressed,나는 내가 우울할 때 그것을 웃어 넘기려고 최선을 다하곤 했다
i am depressed and i hate myself and its my fault,나는 우울하고 내 자신이 싫고 내 잘못이다
i have suicidal thoughts and days where i can't get out of bed but i feel sad,나는 자살 생각과 침대에서 일어날 수 없는 날들이 있지만 슬프다
i am depressed and sad every day and i think about death every day,나는 매일 우울하고 슬프고 매일 죽음에 대해 생각한다
but when i am depressed i like to justify my feelings,하지만 내가 우울할 때 나는 내 감정을 정당화하는 것을 좋아한다
my parents tell me to cheer up because i shouldn't have anything to feel depressed about but i still can't,나의 부모님은 내가 우울해하면 안되기 때문에 나에게 힘을 내라고 말하지만 나는 여전히 그럴 수 없다
i am more the type of person who can't even pinpoint why i am depressed i've had a seemingly okay life nothing too tough or traumatizing,나는 내가 왜 우울한지 정확히 말할 수조차 없는 타입의 사람이다. 나는 겉보기에 괜찮은 삶을 살았고 너무 힘들거나 충격적이지 않았다
i feel lonely amp ashamed because i have no one to talk to,나는 대화할 사람이 없어서 외롭고 부끄럽다
i just don't care about anything anymore i don't even know if i am depressed that's why i am here i think i am though,나는 더 이상 아무것도 신경 쓰지 않을 뿐이야. 내가 우울한지 조차도 몰라. 그래서 내가 여기 있는 것 같아. 하지만
i think a lot of people who feel depressed try and find some big picture reason behind it and can't,나는 우울함을 느끼는 많은 사람들이 그것 뒤에 숨겨진 큰 그림 이유를 찾으려고 노력하지만 찾을 수 없다고 생각한다
it's funny no one would know that i am depressed i am the most cheerful person they know,아무도 내가 우울하다는 것을 알지 못한다는 것이 웃기다. 나는 그들이 아는 가장 쾌활한 사람이다
i've recently realized that i am depressed,나는 최근에 내가 우울하다는 것을 깨달았다
saying hello to strangers in this new city where i am lonely,내가 외로운 이 새로운 도시에서 낯선 사람들에게 인사하는 것
when i am depressed my boyfriend doesn't get frustrated or annoyed,내가 우울할 때 내 남자친구는 좌절하거나 짜증내지 않는다
i like anything by andrew mcmahon when i am sad something corporate jacks mannequin he also recently released a solo album,나는 앤드루 맥마혼의 어떤 것이든 내가 슬플 때 기업 잭스 마네킹 그도 최근 솔로 앨범을 냈다
i am jobless and not wanting to admit i am depressed,나는 직업이 없고 내가 우울하다는 것을 인정하고 싶지 않다
been feeling like this for a few days not sure if i am depressed,내가 우울한지 며칠 동안 이런 기분이었다
i don't want to get too into it but i am depressed and anorexic,나는 그것에 너무 빠져들고 싶지 않지만 나는 우울하고 거식증이 있다
part of the reason i like sad movies is that sadness is a significant upgrade to my depression and sadness doesn't feel inauthentic while i am depressed,내가 슬픈 영화를 좋아하는 이유 중 하나는 슬픔이 나의 우울함에 대한 중요한 업그레이드이고 슬픔은 내가 우울할 때 진실하지 않다고 느끼지 않기 때문이다
i just feel depressed and helpless,나는 그저 우울하고 무력감을 느낀다
i am  years old i think i am depressed but honestly i have no clue what the hell is going on with me,나는 나이가 들어 우울하다고 생각하지만 솔직히 나는 나에게 도대체 무슨 일이 일어나고 있는지 전혀 모른다
i am very good about hiding my sadness as no one has ever asked if i am depressed but i don't want it to be that way,아무도 내가 우울한지 물어본 적이 없기 때문에 나는 내 슬픔을 숨기는 것에 매우 능숙하지만 나는 그렇게 되길 원하지 않는다
there are some days i feel good but most of the days i feel depressed probably because no one likes me,기분이 좋은 날도 있지만 대부분의 날은 아무도 나를 좋아하지 않아서 우울해
i know there is no reason i should feel unhappy,내가 불행하다고 느껴야 할 이유가 없다는 것을 안다
some days i feel good and happy some days i feel sad and alone,"어떤 날은 기분이 좋고, 어떤 날은 슬프고, 어떤 날은 혼자입니다"
she just replied with yeah if i wasn't doing anything i would feel depressed too,그녀는 내가 아무것도 하지 않았다면 나도 우울했을 것이라고 대답했다
i try and talk to the wife but she says i just feel sad,나는 아내와 이야기하려고 노력하지만 그녀는 내가 단지 슬프다고 말한다
when i feel sad i like to go outside and he goes for walks or drives with me,내가 슬플 때 나는 밖에 나가는 것을 좋아하고 그는 나와 함께 산책이나 드라이브를 간다
you feel abandoned by them and then you question who your friends are and you start to feel lonely,"당신은 그들에게 버림받았다고 느끼고, 그리고 나서 당신의 친구들이 누구인지에 대해 의문을 품게 되고, 당신은 외로움을 느끼기 시작한다"
so i am depressed i've come to terms with that,그래서 나는 우울하다. 나는 그것을 받아들이게 되었다
i hate myself because i am depressed,나는 우울하기 때문에 내 자신이 싫다
i too am depressed and have been my whole life i just never realized it,나도 우울하고 평생을 살아왔지만 전혀 깨닫지 못했어
but what if i still feel that emptiness and deep down inside i am sad i feel like it wouldn't be fair to them,하지만 만약 내가 여전히 그 공허함과 마음 깊은 곳에서 느낀다면 나는 슬프고 그것이 그들에게 공평하지 않을 것 같은 느낌이 든다
my loneliness has led me to jump into some meaningless relationships before but learned that you could be with someone and still feel lonely,"나의 외로움은 내가 이전에 무의미한 관계에 뛰어들도록 이끌었지만, 네가 누군가와 함께 있을 수 있고 여전히 외로움을 느낄 수 있다는 것을 배웠다"
yet i still feel depressed my best guess is that it's because i haven't talked to anyone in three days,하지만 나는 여전히 우울해. 내가 추측하기로는 3일 동안 아무와도 얘기하지 않았기 때문일 거야
i am depressed but its overwhelming me how bad it really feels,나는 우울하지만 그것이 정말로 얼마나 기분이 나쁜지 나를 압도한다
all the best in life candle of hope  i am depressed he said i am hearing voices in my head pause,희망의 촛불 나는 우울하다고 그는 내 머리 속에서 목소리가 멈춘다고 말했다
of course very rarely do people truly feel depressed  of the time,물론 사람들이 진정으로 그 시간에 대해 우울함을 느끼는 경우는 매우 드물다
under that facade i am depressed,그 정면 아래에서 나는 우울하다
so the thing is i don't really feel sad,그래서 문제는 내가 정말 슬프지 않다는 것이다
it is okay to be sick or feel depressed,아프거나 우울한 것은 괜찮다
and i have no one that would miss me maybe that's why i am depressed but i just am so tired of living,그리고 나는 나를 그리워할 사람이 없다. 그래서인지 나는 우울하지만 나는 단지 사는 것이 너무 지겹다
now that my ankle is healed though i feel depressed again,다시 우울해지긴 했지만 발목이 다 나았으니
the occasional sad day or sad  minutes is normal  i think and you shouldn't worry about the need to feel sad occasionally,가끔 슬픈 날이나 슬픈 분들은 정상이라고 생각하고 가끔 슬퍼할 필요에 대해 걱정하지 말아야 한다
the reason why i ask if i am depressed is because i still manage to get excited about things occasionally,내가 우울한지 묻는 이유는 내가 여전히 가끔 일에 흥분하기 때문이다
could it be someone that could help me not to feel depressed and alone no,내가 우울하지 않고 혼자가 되지 않도록 도와줄 수 있는 사람일까
i am pretty sure i am depressed although i've never been to see anyone about it but i am worried about talking to my parents about it,나는 그것에 대해 누군가를 만나러 간 적이 없지만 우울하다고 꽤 확신하지만 나는 그것에 대해 부모님과 이야기하는 것이 걱정된다
personally i like to ride my bike when i am depressed,개인적으로 나는 우울할 때 자전거 타는 것을 좋아한다
they don't realise i am sad that i am tired,그들은 내가 피곤해서 슬프다는 것을 깨닫지 못한다
with that i never cry and i want to feel sadness but i cannot,그것으로 나는 절대 울지 않고 슬픔을 느끼고 싶지만 그럴 수 없다
though i say no because as soon as a trigger for a current problem comes up i start to slowly feel depressed again,비록 내가 아니라고 말하지만 왜냐하면 현재의 문제에 대한 트리거가 발생하자마자 나는 천천히 다시 우울해지기 시작하기 때문이다
 am  am sad what am i doing with my life am  am deep depression cry myself to sleep every night,나는 슬프다 나는 내 인생에서 무엇을 하고 있는지 나는 깊은 우울증에 걸려 매일 밤 울면서 잠을 잔다
see it's not like i am sad all the time,내가 항상 슬퍼하는 것은 아니다
typically when i am depressed for a period of time i am unable to feel present,일반적으로 내가 일정 기간 동안 우울할 때 나는 현재를 느낄 수 없다
do i walk in and just say i don't answer the phone i am depressed what is the threshold i appreciate you guys,내가 들어와서 전화를 받지 않는다고 말하는 건가요? 우울해요. 문턱이 무엇인지 당신들에게 감사해요
i don't even know if i am depressed but i don't want to potentially burden my friends or tie up a professional's useful time,나는 내가 우울한지 조차 모르지만 나는 잠재적으로 내 친구들에게 부담을 주거나 전문가의 유용한 시간을 묶고 싶지 않다
i am depressed again and i don't think i can tell him,나는 다시 우울해졌고 그에게 말할 수 없을 것 같아
when i am lonely because i can't relate there's been nothing i or anyone else could do to make myself feel better,"내가 관계를 맺을 수 없어서 외로울 때, 나 자신이나 그 누구도 내 기분을 나아지게 하기 위해 할 수 있는 것은 아무것도 없었다"
they all know i am depressed as well and have been for a very long time,그들은 모두 내가 우울하다는 것을 알고 있고 매우 오랫동안 그래왔다
being depressed is like having blinders over your eyes and you feel like you have and will always feel sad,우울해지는 것은 당신의 눈을 가린 것과 같고 당신은 당신이 그랬던 것처럼 느끼고 항상 슬퍼할 것이다
i am and  yearold male and i am depressed,저는 나이는 남자이고 우울해요
in most cases i feel lonely because i am not in a romantic relationship,대부분의 경우에 나는 낭만적인 관계가 아니기 때문에 외롭다
when i am depressed i spend a majority of my time distracting myself from myself  sleep tv internet smoking,내가 우울할 때 나는 대부분의 시간을 나 자신으로부터 주의를 돌리는데 보낸다. 잠 TV 인터넷 흡연
when i am sad or depressed i am ugly,내가 슬프거나 우울할때 나는 못생겼다
you feel depressed for a reason,당신은 이유가 있어서 우울해요
the counsellor i saw doesn't even think i am depressed,내가 본 상담사는 내가 우울하다고 생각하지도 않는다
i don't have days where i feel depressed anymore,나는 더 이상 우울한 날이 없다
i am  pounds now and have been for  years because i don't eat enough when i am depressed  is my healthy weight,나는 지금 파운드이고 우울할 때 충분히 먹지 않는 것이 건강한 몸무게이기 때문에 몇 년째이다
i don't understand depression or how people can feel depressed,나는 우울증이나 사람들이 어떻게 우울함을 느낄 수 있는지 이해할 수 없다
it may be a little hard if you both feel depressed at the same time,만약 둘 다 동시에 우울하다면 그것은 조금 힘들 수도 있다
the reason i am depressed is because i can't find the courage or strength or energy or whatever to break the cycle,"내가 우울한 이유는 사이클을 깰 용기, 힘, 에너지 또는 무엇이든 찾을 수 없기 때문이다"
