idx,text,translated,cnt,weakest_cnt,strongest_cnt
653,sometimes it feels like im forcing myself to feel sad and i dont even know why because i dont want to be sad,가끔은 내가 슬퍼하도록 강요하는 것처럼 느껴지고 슬퍼하고 싶지 않기 때문에 왜 그런지조차 모르겠어,0,0,0
654,when i am depressed my anxiety levels also sky rockets,내가 우울할 때 나의 불안 수준 또한 스카이 로켓이다,0,0,0
655,whenever i think like this it makes me feel sad and lonely because i feel helpless to my situation,내가 이렇게 생각할 때마다 내 상황에 무력감을 느끼기 때문에 그것은 나를 슬프고 외롭게 만든다,0,0,0
656,although there was a bit that made me feel unhappy there i also had some sense of security and independence,비록 그곳에서 나를 불행하게 만드는 약간의 것이 있었지만 나는 또한 약간의 안정감과 독립심을 가지고 있었다,0,0,0
657,people say they feel depressed after watching a sad movie,사람들은 슬픈 영화를 보고 우울하다고 말한다,0,0,0
658,i don't really feel sad but i do feel like life is passing me by,나는 정말 슬프지는 않지만 삶이 나를 스쳐 지나가는 것 같다,0,0,0
659,you're not going to feel sad for your loved ones after you take the exit because you will no longer exist,당신은 더 이상 존재하지 않을 것이기 때문에 출구를 떠난 후 사랑하는 사람들에게 슬퍼하지 않을 것이다,0,0,0
660,tldr i am sad dear reddit friends,친애하는 레딧 친구들에게 나는 슬프다,0,0,0
661,then it feels like i am lonely for no reason after all i am surrounded by friends but there actually is a reason,친구들에게 둘러싸여 있으니 왠지 외롭지만 사실은 이유가 있다,0,0,0
662,when i am depressed i feel that is all i ever known in my life,내가 우울할 때 나는 그것이 내 인생에서 내가 아는 전부라고 느낀다,0,0,0
663,not because i am depressed or whatever,내가 우울해서가 아니다,0,0,0
664,actually i tell myself this even when i am depressed fake it til you make it if you will,사실 나는 내가 우울할 때 조차도 네가 할 수 있을 때까지 가짜라고 스스로에게 말한다,0,0,0
665,if it wasn't real we wouldn't have a name for it right you don't deserve to feel sad,그것이 진짜가 아니었다면 우리는 그것에 대한 이름을 가지고 있지 않았을 것입니다. 당신은 슬퍼할 자격이 없습니다,0,0,0
666,i wouldn't say i am lonely i have tonnes of friends just none that i'd ever talk to about how i am actually feeling,나는 내가 외롭다고 말하지 않을 것이다. 나는 내가 실제로 어떻게 느끼는지에 대해 이야기한 적이 없는 친구들이 많다,0,0,0
667,hello im a  year old boy and i think i am depressed,안녕하세요 저는 1살 소년이고 우울한 것 같아요,0,0,0
668,i guess i should have clarified that it wasn't because i am depressed,내가 우울해서가 아니라는 것을 분명히 했어야 했다고 생각한다,0,0,0
669,it's difficult to answer this question but i am  and i've had some pretty shitty stuff happen and i feel depressed more often than not,이 질문에 대답하는 것은 어렵지만 저는 그리고 저는 꽤 형편없는 일들을 겪었고 저는 종종 우울해요,0,0,0
670,i feel sad for what i can't do,나는 내가 할 수 없는 것에 대해 슬프다,0,0,0
671,but i don't know about you guys but the moments of happiness end up making me feel sadder than the depression itself,하지만 나는 너희들에 대해 잘 모르지만 행복의 순간들은 결국 나를 우울 그 자체보다 더 슬프게 만든다,0,0,0
672,therapist told me i am depressed today,치료사는 나에게 오늘 우울하다고 말했다,0,0,0
673,i used to feel sad and terrified of being alone all the time a few years back but now i haven't felt anything in a while,몇 년 전에는 항상 혼자 있는 것에 대해 슬프고 무서웠지만 지금은 한동안 아무 것도 느끼지 못했다,0,0,0
674,no one to talk to i never really talk about problems anyway the most being i drunkenly told one of my best friends i am depressed,대화할 사람이 아무도 없다. 어쨌든 나는 문제에 대해 정말로 이야기하지 않는다. 나는 술에 취해 내 가장 친한 친구 중 한 명에게 내가 우울하다고 말했다,0,0,0
675,hey man i am just browsing here because i feel lonely,"이봐 친구, 나는 외롭기 때문에 그냥 여기를 둘러보고 있어",0,0,0
676,this is pretty much my exact situation and why i feel depressed,이것이 거의 나의 정확한 상황이고 내가 우울한 이유이다,0,0,0
677,but i've seen them sleep with a different girl every night and i know that's college but it makes me feel lonely,하지만 나는 그들이 매일 밤 다른 여자와 자는 것을 보았고 그것이 대학이라는 것을 알지만 그것은 나를 외롭게 만든다,0,0,0
678,it's not that i am depressed so much but i just can't stop wondering about suicide,내가 그렇게 우울한 것은 아니지만 자살에 대한 궁금증을 멈출 수 없다,0,0,0
679,i live alone in a big house and i don't have a lot of people that i consider 'friends' so i am lonely very often,나는 큰 집에서 혼자 살고 있고 '친구'라고 생각하는 사람이 많지 않아서 매우 자주 외롭다,0,0,0
680,i don't know i don't think i am depressed but i know these thoughts aren't normal ,나는 내가 우울하다고 생각하지 않는다는 것을 모르지만 나는 이러한 생각이 정상이 아니라는 것을 안다.,0,0,0
681,the fact that i am cynical quiet negative and countless other things doesn't go away when i say i am depressed,내가 냉소적이고 부정적이라는 사실과 내가 우울하다고 말할 때 다른 무수한 것들이 사라지지 않는다,0,0,0
682,i have the same problem and my family just doesn't believe that i am depressed,나도 같은 문제가 있고 우리 가족은 내가 우울하다는 것을 믿지 않는다,0,0,0
683,i am constantly bothered by people who do not know i am depressed the phone rings too often people i have no desire to see want to hang out,나는 내가 우울한 줄 모르는 사람들 때문에 끊임없이 괴롭다. 내가 보고 싶지 않은 사람들이 너무 자주 전화가 걸려온다,0,0,0
684,i had to breakdown emotionally to tell them i am depressed and suicidal after all these years because i felt so repressed,나는 그들에게 내가 너무 억압받았기 때문에 수년 후에 우울하고 자살했다고 말하기 위해 감정적으로 무너져야 했다,0,0,0
685,and i feel lonely very lonely,그리고 나는 매우 외롭다,0,0,0
686,i feel more alive in a sense when i am depressed,나는 우울할 때 어떤 의미에서 더 살아있음을 느낀다,0,0,0
687,no i don't think i am depressed on purpose and it definitely isn't easier to be depressed,아니 나는 내가 일부러 우울하다고 생각하지 않고 우울해지는 것이 확실히 더 쉽지 않다,0,0,0
688,i am certain i am depressed,나는 내가 우울하다고 확신한다,0,0,0
689,it's like is pointing out that i am sad really gonna help me be less sad,내가 슬프다는 것을 지적하는 것은 내가 덜 슬프도록 도와줄 것이다,0,0,0
690,and when i am sad i always eat my feelings,그리고 내가 슬플때 나는 항상 내 감정을 먹어치운다,0,0,0
691,i want to ask my sister since she's better at these type of things but i am afraid she'll treat me different if i admit i am depressed,언니가 이런 것들을 더 잘하기 때문에 물어보고 싶지만 내가 우울하다는 것을 인정하면 언니가 나를 다르게 대할까 봐 두렵다,0,0,0
692,most people wouldn't think that i am depressed or suicidal,대부분의 사람들은 내가 우울하거나 자살했다고 생각하지 않을 것이다,0,0,0
693,i am sure you're not expecting it to solve problems but it's not fun to feel lonely,나는 네가 그것이 문제를 해결할 것이라고 기대하지 않는다고 확신하지만 외로움을 느끼는 것은 즐겁지 않다,0,0,0
694,they ignore my texts when i am sad they barely talk to me even though we would talk for hours on end,그들은 내가 슬플 때 내 문자를 무시한다. 그들은 우리가 몇 시간 동안 계속 대화할 것임에도 불구하고 그들은 나에게 거의 말을 하지 않는다,0,0,0
695,i don't do anything because i am depressed,나는 우울해서 아무것도 하지 않는다,0,0,0
696,whenever i am sad or depressed she tells me to snap out of it,내가 슬프거나 우울할 때마다 그녀는 나에게 정신을 차리라고 말한다,0,0,0
697,i feel lonely tired not caring and i don't look forward to the future,나는 신경 쓰지 않는 것이 외롭고 피곤하며 미래를 기대하지 않는다,0,0,0
698,i told a friend that i wouldn't go to a party with him saturday because i am depressed and really couldn't make it and he just replied fuck depression,나는 친구에게 토요일에 그와 파티에 가지 않겠다고 말했다. 왜냐하면 나는 우울하고 정말 갈 수 없기 때문이다. 그리고 그는 그냥 빌어먹을 우울증이라고 대답했다,0,0,0
699,i should be content i always feel lonely,나는 만족해야 한다. 나는 항상 외로움을 느낀다,0,0,0
700,i just feel lonely and unwanteda little help please,나는 단지 외롭고 원하지 않는 도움을 조금만 주세요,0,0,0
701,i do it when i can't feel anything and just wanna feel sad angry happy anything  so long as i feel something,나는 내가 아무것도 느낄 수 없을 때 하고 단지 내가 무언가를 느끼는 한 슬프고 화가 나고 행복한 어떤 것이든 느끼고 싶을 때 그것을 한다,0,0,0
702,i feel sad if i really think about it hard but for the most part i just feel disconnected,정말 열심히 생각하면 슬프지만 대부분은 그냥 연결이 끊어진 느낌이야,0,0,0
703,anyone who want to help me self diagnose whether i am depressed or not would be nice,내가 우울한지 아닌지 스스로 진단하는 것을 돕고 싶은 사람은 누구나 좋을 것이다,0,0,0
704,i am depressed but i don't feel bad,나는 우울하지만 기분이 나쁘지는 않다,0,0,0
705,i posted on this sub yesterday with a very lengthy story explaining why i am depressed,나는 어제 내가 우울한 이유를 설명하는 매우 긴 이야기와 함께 이 서브에 글을 올렸다,0,0,0
706,i am depressed suicidal but also pretty anxious especially socially anxious and the one thing that is keeping me from jumping off the balcony is anxiety,나는 자살로 우울하지만 또한 꽤 불안하다. 특히 사회적으로 불안하다. 그리고 내가 발코니에서 뛰어내리는 것을 막는 한 가지는 불안이다,0,0,0
707,wiggi i am sad you never mentioned this to us before but i can completely understand your reasoning,Wiggi 나는 네가 이전에 우리에게 이것을 언급하지 않은 것이 슬프지만 나는 너의 추론을 완전히 이해할 수 있다,0,0,0
708,car got stolen and living with my parents im m i can't sleep i am sad all the time overeating and nothing interests me anymore,차를 도난당해서 부모님과 함께 살고 있어요. 잠을 잘 수가 없어요. 항상 너무 많이 먹어서 슬퍼요. 더 이상 관심 있는 건 없어요,0,0,0
709,i to am depressed on every level and it fucking sucks,나도 모든 수준에서 우울하고 형편없어,0,0,0
710,i still feel lonely,나는 여전히 외로워,0,0,0
711,i am depressed and i just talk too the girl i love and i feel so much better no matter what,나는 우울하고 내가 사랑하는 여자와 이야기만 하고 무슨 일이 있어도 기분이 훨씬 좋아,0,0,0
712,i can honestly say that there should be no reason physically why i am depressed,나는 솔직히 내가 우울한 이유가 육체적으로 있어서는 안 된다고 말할 수 있다,0,0,0
713,the reason i am depressed literally has no solution as the world stands now,내가 우울한 이유는 말 그대로 지금 세상이 있는 것처럼 해결책이 없다,0,0,0
714,perhaps it is my girlfriend of  months i don't know but i am still unsure whether i am depressed or not,아마도 그것은 내가 몇 달 동안 사귀어 온 여자친구일 것이다. 하지만 나는 여전히 내가 우울한지 아닌지 확신할 수 없다,0,0,0
715,i have been depressed for  months now and i am really scared to tell my parents that i am depressed,나는 지금 몇달째 우울해 그리고 나는 부모님께 내가 우울하다고 말하는 것이 정말 무섭다,0,0,0
716,but because of that my parents think i am depressed because of her,하지만 그것 때문에 나의 부모님은 내가 그녀 때문에 우울하다고 생각한다,0,0,0
717,i want to get help i want to tell people other than strangers that i am depressed i am hollow i am broken,나는 도움을 받고 싶다. 나는 낯선 사람들이 아닌 다른 사람들에게 내가 우울하다고 말하고 싶다. 나는 속이 비어 있다. 나는 망가졌다,0,0,0
718,edit also i forgot to mention my friends have no idea that i am depressed as i act pretty happy and funny around them as a front,내가 친구들을 앞에 두고 꽤 행복하고 재미있게 행동하기 때문에 내가 우울하다는 것을 전혀 알지 못한다는 것을 언급하는 것도 잊었다,0,0,0
719,only would talk about real stuff with one but i always do that and he doesnt open up to me much so i dont know if id rather feel lonely,오직 한 명과 실제 일에 대해 이야기할 뿐이지만 나는 항상 그렇게 하고 그는 나에게 마음을 많이 열지 않아서 차라리 내가 외로움을 느끼는지 모르겠다,0,0,0
720,if i feel depressed i am,만약 내가 우울하다면 나는 우울하다,0,0,0
721,i made special points to talk with more strangers maintain eyecontact and be up for more social events and yet i am lonely,나는 더 많은 낯선 사람들과 대화하기 위해 특별한 포인트를 만들었고 눈을 마주치고 더 많은 사회적 행사에 참석했지만 나는 외롭다,0,0,0
722,funny thing is she knows i am depressed and suicidal,재미있는 것은 그녀가 내가 우울하고 자살했다는 것을 안다는 것이다,0,0,0
723,i have close friends yet i am lonely and i definitely started noticing this around ,나는 여전히 친한 친구들이 있지만 외롭고 나는 분명히 주변에서 이것을 알아차리기 시작했다,0,0,0
724,i sometimes feel sad but sometimes it's just nothing and i don't know which one is worse,나는 가끔 슬프지만 가끔은 아무것도 아니고 어떤 것이 더 나쁜지 모르겠어,0,0,0
725,i am always clean but i become hyperaware of messes or smells when i am depressed,나는 항상 깨끗하지만 우울할 때는 지저분하거나 냄새를 너무 많이 인지하게 된다,0,0,0
726,i am unhappy and i only stay because people seem to not be kind because of my looks and i really don't think i deserve an ounce of happiness,나는 행복하지 않고 단지 내 외모 때문에 사람들이 친절하지 않은 것 같아서 남아있을 뿐이고 나는 정말로 내가 행복할 자격이 없다고 생각한다,0,0,0
727,i don't know if i am depressed i have a lot of friends and i am good looking i could easily get a girlfriend but i don't want,나는 내가 우울한지 모르겠다. 나는 많은 친구들이 있고 잘 생겼다. 나는 쉽게 여자친구를 사귈 수 있지만 나는 원하지 않는다,0,0,0
728,i am depressed becomes who you are i am struggling with depression separates the self and the affliction,나는 우울해요 당신이 되고 있어요 나는 우울증과 싸우고 있어요 자신과 고통을 분리해요,0,0,0
729,and more recently it's been the one thing that has served as a reminder that i am depressed and need help which i am finally doing,그리고 더 최근에 그것은 내가 우울하고 도움이 필요하다는 것을 상기시켜주는 단 한 가지 일이었고 마침내 내가 하고 있다,0,0,0
730,but after my two suicide attempt i don't even feel sad anymore,하지만 두 번의 자살 시도 후에 나는 더 이상 슬프지도 않다,0,0,0
731,i talk to friends or reach out to people when i feel lonely,나는 외로울 때 친구들과 이야기하거나 사람들과 연락한다,0,0,0
732,i have my friends which i love but they don't know i am depressed even though i keep dropping hints,나는 내가 사랑하는 친구들이 있지만 그들은 내가 계속 힌트를 주어도 내가 우울하다는 것을 모른다,0,0,0
733,true but i suppose i feel sad when i am hurt or when i see my parents hurt,사실이지만 나는 내가 다쳤을 때나 부모님이 다치는 것을 볼 때 슬프다고 생각한다,0,0,0
734,he wants to know why i am depressed and come up with fixes,그는 내가 왜 우울한지 알고 싶어하고 해결책을 생각해낸다,0,0,0
735,i know myself and since i am depressed i've only cried literally once,나는 나 자신을 알고 있고 내가 우울하기 때문에 문자 그대로 한 번밖에 울지 않았다,0,0,0
736,i feel like if i tell my parents i am depressed that they'll tell me to suck it up,나는 부모님께 내가 우울하다고 말하면 그들이 나에게 그것을 빨라고 말할 것 같은 기분이 든다,0,0,0
737,i am in a similar situation honestly i am not even sure whether i am depressed or not,나는 솔직히 내가 우울한지 아닌지조차 확신할 수 없는 비슷한 상황에 있다,0,0,0
738,i guess i know i am depressed its really difficult going over this with dr's,나는 내가 우울하다는 것을 알고 있다고 생각한다. 그것은 박사님과 함께 이것을 검토하는 것이 정말 어렵다,0,0,0
739,as soon as i am off work i feel ok and really dont feel depressed,나는 퇴근하자마자 기분이 괜찮고 정말 우울하지 않다,0,0,0
740,instead of me going on about what i am sad about how about we learn stuff about each other not only one on one but with everyone,내가 슬픈 것에 대해 말하는 대신에 우리가 일대일로뿐만 아니라 모든 사람들과 서로에 대해 배우는 것은 어때,0,0,0
741,i am lonely about to be broke and i know i could be so happy and successful if i just had the energy,나는 빈털터리가 되기 직전에 외롭고 내게 에너지만 있다면 내가 매우 행복하고 성공할 수 있다는 것을 안다,0,0,0
742,i was just discussing today about how i don't think i am depressed or am negative but maybe i just see the world more much more realistically than others,나는 오늘 내가 어떻게 내가 우울하거나 부정적이라고 생각하지 않는지에 대해 논의하고 있었지만 아마도 나는 다른 사람들보다 훨씬 더 현실적으로 세상을 볼 것이다,0,0,0
743,gti keep trying to avoid the things that make me feel depressed okay now start doing more things that you like,"gti는 계속해서 나를 우울하게 만드는 것들을 피하려고 노력해, 알겠어 이제 네가 좋아하는 것들을 더 많이 하기 시작해",0,0,0
744,i want to buy anti depressants but i don't have a doctors prescription cause my parents don't know i am depressed,나는 항우울제를 사고 싶지만 부모님이 내가 우울하다는 것을 모르기 때문에 의사 처방전이 없다,0,0,0
745,i feel sad not having them again because i remember how long it took for me to run into said item and get it,나는 내가 그 물건을 우연히 만나 그것을 얻는 데 얼마나 걸렸는지 기억하기 때문에 그것들을 다시 갖지 못한 것이 슬프다,0,0,0
746,i don't want to write much but now it's been a whole two months i feel lonely as fluff,"글을 많이 쓰고 싶지는 않지만, 이제 두 달이 다 되어가는 지금 나는 솜털처럼",0,0,0
747,i feel as though i cant talk to them about my overall emptiness so i feel lonely alone with my thoughts and no one to share them with,나는 그들에게 나의 전체적인 공허함에 대해 말할 수 없는 것처럼 느껴져서 나는 내 생각과 함께 그것들을 공유할 사람이 아무도 없는 외롭다,0,0,0
748,i am depressed all the time but am too busy with work to have time to do anything about it,나는 항상 우울하지만 일이 너무 바빠서 그것에 대해 아무것도 할 시간이 없다,0,0,0
749,if i am depressed there's only one problem i am not sure why,만약 내가 우울하다면 한 가지 문제가 있어 왜 그런지 잘 모르겠어,0,0,0
750,i am unhappy about everything,나는 모든 것이 불행하다,0,0,0
751,whenever i am depressed i can't even comprehend what i am reading a lot of the time,내가 우울할 때마다 나는 내가 자주 읽고 있는 것을 이해할 수조차 없다,0,0,0
752,maybe you actually would but i haven't if i even am depressed,아마도 너는 실제로 그럴 것이지만 나는 우울해도 그렇지 않다,0,0,0
753,i am not low enough to feel sad and cry im not high enough to be genuinely happy,나는 슬프고 울 만큼 충분히 낮지 않다. 나는 진정으로 행복할 만큼 높지 않다,0,0,0
754,i don't know how it is possible to feel lonely having so much people who care about me around,나는 나를 걱정해주는 많은 사람들이 주변에 있는 것이 어떻게 외로움을 느낄 수 있는지 모르겠다,0,0,0
755,ideally i'd rather just leave but the having no experience thing kinda gets in the way and then i am depressed again,이상적으로 나는 그냥 떠나고 싶지만 경험이 없는 것이 방해가 되고 그리고 나서 나는 다시 우울해진다,0,0,0
756,i am here because i am lonely and bored at home and looking for someone to talk with,나는 집에서 외롭고 지루해서 여기에 있고 대화할 사람을 찾고 있다,0,0,0
757,tonight though i feel sad,오늘밤 나는 슬프지만,0,0,0
758,sometimes i do feel sad sometimes i feel hopeless most of the time i don't feel anything or care about anything,가끔은 슬프기도 하고 절망적이기도 해요. 대부분의 시간 동안 아무것도 느끼거나 아무것도 신경 쓰지 않아요,0,0,0
759,i've lied to my doctors and parents when they ask if i am depressed only cause i hate the thought of people worrying about me,나는 내 의사와 부모님이 내가 우울하냐고 물었을 때 거짓말을 한 적이 있다. 왜냐하면 나는 사람들이 나를 걱정한다는 생각을 싫어하기 때문이다,0,0,0
760,i am sad cause i am sad damn it your presence makes me happy stop misinterpreting my sadness,나는 슬프다 왜냐하면 나는 슬프다 빌어먹을 너의 존재가 나를 행복하게 만들어 내 슬픔을 잘못 해석하는 것을 멈추기 때문이다,0,0,0
761,i just want to not feel lonely,나는 단지 외로움을 느끼지 않기를 원한다,0,0,0
762,i would say that while i am depressed even when i am with somebody that life is overall more tolerable with a significant other,나는 내가 누군가와 함께 있을 때조차도 우울할 때 인생은 전반적으로 중요한 다른 사람과 함께 더 견딜 수 있다고 말할 것이다,0,0,0
763,i am depressed because i feel totally and absolutely trapped in this stage of my life with no control of what's happening,나는 무슨 일이 일어나고 있는지 통제할 수 없는 내 삶의 이 단계에 완전히 갇혀 있다고 느끼기 때문에 우울하다,0,0,0
764,i am lonely confused and my family is worried but i avoid talking about it,나는 외롭고 혼란스럽고 가족들이 걱정하지만 나는 그것에 대해 말하는 것을 피한다,0,0,0
765,yet i am sad when i have to be alone,하지만 나는 혼자 있어야 할 때 슬프다,0,0,0
766,i am certain i am depressed but drugs will help alleviate the depression legal and illegal drugs and alcohol,나는 내가 우울하다고 확신하지만 마약은 합법적이고 불법적인 마약과 술을 우울증을 완화하는 데 도움이 될 것이다,0,0,0
767,it didn't just start now but more and more i feel lonely and what not,그것은 지금 시작된 것이 아니라 점점 더 나는 외로움과 무엇이 아닌 것을 느낀다,0,0,0
768,even though i am depressed still that moment of the day was good to have to put off some weight that was on my mind,"비록 나는 여전히 우울하지만, 그날의 그 순간은 내 마음에 있던 무게를 미뤄야 해서 좋았다",0,0,0
769,i don't think i am depressed i am just,나는 내가 우울하다고 생각하지 않는다. 나는 단지,0,0,0
770,i've always had my moments you know where some days i am sad and some days i am okay but it seriously hit me hard when i got pregnant,나는 항상 내 순간들을 가졌어. 너도 알다시피 내가 어떤 날은 슬프고 어떤 날은 괜찮아. 하지만 내가 임신했을 때 그것은 나에게 심각한 타격을 줬어,0,0,0
771,i am depressed because i've disappointed everyone my colleagues my parents my friends everyone who ever looked up to me,나는 내가 나를 존경하는 모든 사람들을 실망시켰기 때문에 우울하다,0,0,0
772,i am depressed because i look like a yearold boy and i'll never look like an actual man or be worthy of being loved no matter what i do,나는 우울하다 왜냐하면 나는 한 살짜리 소년처럼 보이고 내가 무엇을 하든 결코 실제 남자처럼 보이지 않거나 사랑받을 가치가 없을 것이기 때문이다,0,0,0
